슬혜씨.. 벗으려면 제대로..,1
알바들  조작금지 차원 0,1
괴물이 나타나도 심심허네,1
1점도 아까운영화 OOO영화,1
너무 시시하고 유치해유.  제목 번역 어느 바보가 적나라하게 했네유. 리바이어던.,1
"차라리 심형래의 티라노의 발톱이 나을듯, 막판에 괴물 탈쓰고 나왔을땐 쩝",1
"로보캅보다 6년이나 뒤에 만들어졌는데.. 완전 개판. 아주 공식에 충실한 영화. 결국 백인 남녀한쌍만 살아남네. 그리고 막판에 막장이야. 상어에다가.. 아주,. 잘 한다.",1
그냥 심해의 에어리언 이라고 할까.. 긴장감도 없고 재미도 없으며 졸나 유치 했다 18,1
에어리언 아류.차라리 외계인이라하지.시나리오자체가 설득력 없고 비약 심하고 엉성,1
에일리언 짭퉁. 지루하고 어이없는 초등용영화. 막판 상어가 수준을 말해준다. ㅋ,1
당시 기준으로도 점수를 주기가 정말 힘들다.,1
비급나름기대많이햇는데 괴물이나 사람이나 하는게 없네...,1
차라리 딮식스가 낫고 어비스와 비교하다니. 인간들 얼굴이 뒤섞인 괴물은 코미디다,1
그런데로 볼만하다,1
소련 난파선 레비아탄의 보드카 후폭풍. 핵자 없는 비 무비의 맛.,1
마지막에 상어와 괴물이 왜나와 참 영화답네 B급영화 필이 팍팍느껴져,1
킬링타임용..,1
"영상은 그림과 같이 아름다우나,  스토리는 지루한 작품",1
말그대로 그림이 움직이면 쓰나,1
셜리와 함께 92분 동안 자다 나오시면 됩니다.,1
영화와 회화와 소설의 모호한 경계. 작위적이고 지루하다.,1
담배 꺼라... 확!...,1
스틸사진이살짝움직인다에 의의를 둔다면보셔도됩니다그림을 움직이게 하다니!,1
에드워드 호퍼의 연대기와 작품세계를 알지못하는 저 같은 사람이라면 누구에게나 매우 지루한 영화일 겁니다. 상영관 혹은 배급사에서 관객들에게 호퍼에 대해 안내하는 작은 팜플렛이라도 나눠 줬으면 훨씬 반응이 좋지 않았을까 합니다.,1
설리에 관한 모든것 인줄 아랐네 ㅡㅡ,1
좋다 아름답다 헛소리 하는 사람 정말 알바다 디워 이후 영화 보다 자본건 간만인것 같네요 그것도 영화초반부터 잤음 흐름도 이어지지도 않고 너무 심오하시고 예술적이셔서 내용 파악이 안됨....에드워드 호퍼 그림이랑 대체 무슨 상관인지...,1
영화 번역이 정말 잘못된것 같습니다. 그렇지만 번역을 제외하더라도 ... 좀 실망이 큽니다. 영상미만 갖오하다 끝난거 같습니다.,1
진짜 드럽게 재미없다 에드워드 호퍼 그림에 배경 빼고는 볼게 아닌영화,1
판타지물로 볼거리도 거의 없고 영...부족한 느낌...지루하기만하다,1
개인적인 관짐이지만 완전 음악X 주교연기X 85년도작이라도 이건 좀 아니다 싶음....,1
오 마이갓 ~,1
"동안의 매튜 브로데릭, 미쉘파이퍼의 신비로움만 기억에 가득",1
한번 내려보자~,1
"나름대로 재미는 있는데,가치는 재미만큼 없는 영화.",1
80년대 한국을 대표하는 에로작,1
2011年 11月/ 곰TV덕분에 내가 이런 작품도 보는구나;;,1
전두환 정권 초기 3S정책에 대한 영화판의 적극적 호응,1
80년대 한국영화들은 이런 3류 에로가 대세였지,1
이런에로물을 티비로해주다니..ㅋㅋ 꽝꽝..ㅡㅡ;,1
신음의 아들임... 왜인지는 보면 아실듯,1
90년에 만든 영화치곤 여러가지 면에서 골고루 ㅅㅌㅊ라 본다. 하지만 별하나준다. 왜냐? 심술이다.,1
굉장히 좋은 작품이다.그래도 평점조절을 위해 1점을준다.한 7.4가 적당하지않나싶다.,1
양아치한테 나라를 맡기느니 일본인한테 나라를 맡기겠다,1
김두한은 야쿠자 선우영빈과 호형호제했던 한낱 깡패새끼에 불과하다,1
무식한 임권택이 김두한을 백야선생의 아들로 둔갑시켰다. 그 역사적 죄는 아주크다.,1
개인적으로 우리민족의한이 어쩌구...이런정서에 상당한 거부감이있다.영화제용 영화.,1
불쾌한 자학적 역사관. 역 오리엔탈리즘.,1
난 별루다,1
당시 한국영화의 주류를 이루던 저질 작품의 대표작,1
70억원의 제작비를 투입해 만든 엄청난 무협 블록버스터,1
그냥 노잼..추억팔이감성영화..아무런감동도 로맨틱도 재미도없다.대사도없고.. 단지 그시절에 다른영화가 시도하지 못한 장르로 사람들에게 어필한거같은데 그점에서 도전정신은 박수쳐줄만해서 1점준다..왠만한 영화광들이거나 오타구아니면 시도하지말아야할영화다.,1
그때나 지금이나 개.쓰레기 남자들은 여전했구나,1
어처구니 없는 영화..다만 볼거리는 당대 최고 미녀였던 이보희의 최고 모습을 볼수있었던점.,1
김명곤띨빵한게내친구같더라저런사람들이사회에버림받고노숙자되지,1
배우들 하나같이 다 발연기 ....  김꽃비란 사람도 연기 넘 못하심 ; 지못미,1
"예전에 본 건데, 뭐 이정도 라는 기억만 난다.",1
김꽃비가 연기를 잘하긴 잘하구나.. 일본애들은 일본어로 연기해도 어색하다. 몰입감은 한국인이 나와서 그런지 그럭저럭인데 슬래셔물치고는 그닥.. 그리고 감독이 참 못 만들었다.,1
너무 재미없다..  이딴  영화가  개봉한게  놀라울뿐이다..  일본에서만 개봉하지...,1
포스터만 보면 재미있어 보이지만 내용은 감독을 죽이고 싶은 내용,1
꽃비양 거긴 왜 간게요?,1
와 미치겠다-_- 나 뭐본거야,1
호스텔보다 강력해? 이걸보느니 호스텔을 10번보는게 나을듯.,1
이걸 영화라고 쳐 만들었나..잔인하게 하려면 잔인 하게 쳐 만들던가.. 애들 장난 한느것도 아니고.. 살인자가 그냥 다른 사람 몸속에 들어간다는 어이 없고 황당한 애기..전형적인 쓰레기 원숭이 영화답다 18,1
대체 머하자는 플레이냐 김꽃비는 왜 출연한거여,1
뭐 이러  개떡같은 영화가 다 있냐..필름이 아까워..,1
어이가없다. 감독이 유친원생이냐,1
참 어이없는 슬래셔물...갑자기 빙의를 하는데다....뭐지?[-_= 김꽃비란 한국 배우는 왜 이 작품에 나온겨,1
로그인하게 만드네 ㅡ ㅡ^  나랑 장난해? 보지마세요;;; 그냥 너무 어거지에 무섭지도 않고;;;,1
평가할 가치도 없이 죽도록 저질스러운 영화. 배우들의 민망한 발연기는 덤. 한명 빼고...,1
"""여자도 거기 맞으면 아퍼!!"" 꽃비양 대사에서 빵터짐..",1
"너무 구리다. 감독이 쓰레기다. 슬래셔 영화 중에서도 최악이라 할만하다. 폐급도 아닌 그냥 쓰레기다. 소품, 음향, 카메라, 연기 할 것 없이 전부. 꽃비야 왜...",1
마이너스 못줌?; 이건 무슨 유학생들이 장난삼아 홈비디오로 찍은 수준; 스토리가 거의 망상수준이고 짜임도 엉망이에 영상처리는 아마추어 수준이하이고 배우들 연기는 영화 분위기하고 따로따로 겉돌아서 마치 중학생들 미술과제영상 보는듯..,1
김꽃비가 시나리오를 제대로 읽은건가....아무것도 얻을게 없는 작품일텐데 말이지 결론은 뭐 한국인이 일본인 죽여버렸네?,1
죽도록 재미없는 영화 = 이렇게 영화 제목 바꾸면 흥행 할듯 별도 아깝다,1
개막장 쓰레기 영화 ㅋㅋ 시청자의 이해관계도 돕지않고 막장으로 흘러감 내용전개도 터무니없고 내용구성도 매우 유치하고 저급함,1
배우들의 계속되는 발연기와 어이없이 전기충격기 하나로 남녀 영혼이 바뀌는 설정...김꽃비...한국에 영화다운 영화가 없어서 쪽국의 3류 쓰레기 영화에 출연했나???한국에도 좋은 영화 감독 많은데...그냥 안무섭고 일단 쓰레기영화,1
런닝 타임이 짧아서 다행이다,1
무서워보인다난무서운걸싫어한다,1
"십수년전에 나온 본격적인 한국 슬레셔물들보다 배우들 연기나 몰입감, 영화적 구성이 심히 떨어지는 수준. 김꽃비는 배역의 임펙트도 없고 이런 C급 작품에 소비되기엔 아깝지",1
진부하고 따분하고 재미없고..,1
"별로야,,  지루해,, ㅡㅡ;  결말만 괜춘",1
지루함은 둘째치고 개연성이 하나도 없다 .그냥 감독이 결말만 만들어놓고 여기저기 어거지로 갖다 붙였다,1
전개가 너무 심하게 지루하다. 내가 이걸 예전에 보다가 포기한 이유가 있었어.,1
보지마라.무섭지도않고엉망이다다운받지마라,1
지루해서 죽는줄 알았네...,1
무서워서 시러..,1
ㄱㅈㄴ ㅍㄷㅇㅇ,1
내가 1점주면 5.5점 ㅋㅋ,1
2015년에 보니까 재미 더럽게 없다.. 거품빼자..,1
너무 조잡하고 딱딱한 연출,1
난해한 복선들. 뭔가 있어 보이는 복잡한  플롯. 내가 본 약 500편의 영화 중 하위 넘버파이브의 개 OOO 영화였다. 내가 좋아했던 대배우 로벗드니로 영화 중 두 번째 최악의 영화였던... 1점도 주기 아까운...,1
뭐야이게 절라 재미없네...,1
포스터는 드니로가 주연처럼 만들어놓고....샹,1
대체 어떻게 끝낼까 설마설마하는데 설마였음 개연성도 없고 최악,1
의미를 알수 없는 난해한 장면의 반복,1
몰입도는 좋았는데 대체 어떻게 끝낼까 설마설마하는데 설마였음 개연성도 없고 최악,1
난해하다,1
영화를 본 뒤 평론이나 해설이라도 읽어봐야 이해가 갈법한...,1
"의미를 알 수 없는 난해한 장면의 반복, 지루함...",1
"쉰내나는 감성, 고리타분한 전개",1
스토리가  처음부터 끝까지 진부하고 스포 될까봐 자세히 쓰지는 못하겠지만 이런 상쓰레기같은 남자를 왜...끝은 어영부영 그냥 넘어가고...90년대 영화 본 느낌인데 90년대 영화보다 못한듯...,1
이거돈주고본사람있긴해?,1
이런..사기꾼들 ㅂㄷㅂㄷ..,1
ㅁㅊ 돈주고 보기 아까운 영화,1
초반에 잠깐 좋았다가 산으로 가는 영화,1
공포나 재난영화가 아니라 아예 대놓고 비급 크리쳐개그물임ㅋㅋ 음악 완전 흥겹다ㅋ 5점정도가 적당한 거 같은데 평점이 좀 높아서ㅋㅋ,1
걍 개재미없다 돈주고보지마,1
어휴...  돈 아깝다..  이걸 돈주고 보냐...  ㅋㅋ,1
평점 인플레 조절중..,1
"마지막에 재스민을 반 미친 상태로 거리에 나앉게 된 처지로 그린 건 식상할 뿐더러, 불행을(설령 그녀가 자초한 것이 있다해도) 직시하는 데 방해가 되기도 하네요. 각본이 너무 남성의 시선같기도. 때론 희화화하는 시도나 풍자란 게 너무 쉽구나 싶어요.",1
"연기잘한다고 좋은영화는아니자나 도시의 아름다움도못살리고 인물의 매력도못살리고 머하나얻거나 느끼거나 감동 , 아무것도없는영화",1
보면서 짜증이 너무 나던 영화다. 아니 내 1점은 그 여자에대한 평가다. 너무 짜증이난다. 홧병있는 사람 보지말것.,1
평점에 낚였다..허세 평점들...,1
사람 팔자 모른다 와호장룡에서 그렇게 매력적으로 나올 줄이야,1
이거 0개안됌?  편집이 완벽하다고? 통편집해야 완벽한거아니고?  주연급배우들의 발연기와 쓰레기급내용으로 똘똘뭉친 최고의 쓰레기영화,1
ㅇㅇㅇ???!!!?,1
평점 조작하면 안데용 ㅎㅎ,1
별로다. 이런류의  영화 이제 지겹다.,1
쓰레기에 시간 축내지 말고 못 본 명작들이나 찾아보시길,1
영화 후반에 삽입된 한국(안국동) 화염병 대모시위 장면만 유독 기억에 남는다,1
어설픈 반전,1
ㅋㅋㅋ,1
전기쑈크먹구.. TV속을 들락날락.. 별 희안한 영화 다보네^^,1
막장에 뻔한 스토리....,1
요즘 필립스가 좀 안 팔리긴 하지...,1
이게영화인지....정말허접하다,1
이비자의 멋진풍경을 본건사실인데... 뭔가가....,1
핵 노잼!!  액션도 별로 줄거리도 별로 개연성도 떨어지고 신선함도없고  진부함의 끝을 보여줌,1
보다가 자꾸 르네상스 생각나서 별로였음,1
ㅋ알바천국 알.바.천.국.,1
뻔한 악당에  뻔한 결과. 대체 왜 아버지 친구들은 항상 배신자인거지???슈레더는 그냥 인간인데 이상하게 쎌뿐이고.,1
상영 중 시청자들을 죽이려고 만든 영화.,1
조잡한 인형극,1
이건 게임이 진짜 잼있었는데,1
난 또 재밌는 줄알았지 어릴때 봐도 유치한 영화는 처음이군,1
ㅋㅋㅋㅋㅋㅋㅋ언제 폭풍우치는밤에 메이가 여자로 변했냨ㅋㅋㅋㅋㅋㅋㅋㅋㅋㅋㅋㅋ옛날  폭풍우치는밤에가 더잼내 이건뭐 늑대가 ㅄ같내,1
예고편만 보고도 원작망쳤다는 느낌이 팍오네요.,1
이건 어두운 밤에 비밀 여자와 몰래 나쁜 짓을하는 성인물이다.애들은 절대보면 안됨.,1
똑같은 내용만 나오고 재미도 없음,1
완전 재미없음,1
정말 재밌어요,1
재미가 없네요 이런영화는 인도영화보다 재미없어요 보자미요,1
정말 재미있네요 어떻게 이런 영화가 나올 수 있는지 모르겠요!@,1
gg,1
보다가 너무 지루해서 잠,1
솔직히 이렇게 까지 평점 높을만한 영화는아님,1
티벳독립 반대한 나쁜놈,1
티벳독립 반대한 나쁜놈,1
정말 유치 짬뽕,1
뭐 이런 영화가 평점이 좋지?,1
글쎄...액션도 별로 없고 스토리도 그닥;;  웃긴것도 아니고 진지한것도 아니고...,1
성룡은 홍콩의 채플린. 하지만 한번 보고 그뿐.,1
성룡의액션씬말고는재미없다,1
3류구만 호들갑은,1
하하하하,1
정말 진심으로 재미없습니다.,1
베리드에 버금가는 초 저예산 영화...스토리 긴장감은 베리드가 더 나음,1
너무 지루하다... 나만 이상한가?,1
전화로 일하고 스트레스 받고 이 OO 떠는걸 영화에서 까지 봐야 되냐?,1
여러분은 지금 톰하디의 BMW광고를 보고계십니다,1
설마 설마 하면서 끝까지 본 내가 미친x이지 차에서 한번도 안내리고ㅋㅋ 개답답  이때 까지 본 영화중 최악,1
주관적으로 보았을때는 이 작품은 뇌파교란을 일으킴..한 아비에 대한 단 한번의 실수와 행동이 상황을..어지럽게 만든다.저는 개인적으로 감정이입을 많이해서 그런지 머리가 아팠네요.,1
내가 수준이 낮은건가. 내가 왜 주인공이 1년전에 저지른 실수때문에 자기 인생 말아먹는 1시간 반을  전화통 붙잡고 있는것만 봐야하는거지..  톰하디가 연기를 잘했기에 별점 2점준다.,1
톰하디 좋아해서 봤지만 이건뭐 지이이이인짜 겁나 재미없다!!!! 내용도 거지같고 결국은 아내 집 직장 다잃는걸로 끝이라니ㅋ 내 아까운 1시간반....아 진짜 괜히봤어.... 도데체 어쩌라는건지 모르겠음,1
톰하디얼굴마담 아니였음 그시간을  못버틸영화 베리드는원맨쇼라도 서스펜스라도 있었지..차타기두시간전 탄탄한직장가정 다버리고 원나잇으로 한방에임신해서 애낳는 여자에게 가는 차량속 얽혀진 끝없는통화세례 생전무책임했던 아비에대한 시위인가?뇌파교란의 음모일까?,1
이거 내가 매일매일 하루가 멀다고 하는 업무인데 남이 하는걸 스크린으로 보게 될줄이야...,1
애하나때문에 그모든걸 포기라 이해안된다 다 망가지는데 결말은 어캐되는건데..이렇게 끝내면 어쩌라고 상상하라고?,1
이영화가 현실적이라고? 톰하디가 안정된 직장과 단란한가정에 찬물을 끼얹으며 외도한 여성의 출산을 보겠다며 차를 모는순간부터가 비현실적,1
이 시간에 딴 영활 봤으면...어휴 이 샹 욕나와...첨부터 끝까지 상영시간 내내 차 안에서 혼자 전화만 받는다...또 어떤 얼라는 지 혼자만 재밌었다고 심오한 영화라 그러겠지?..보지마라 절대로...도시락 싸가지고 다니며 말리련다.,1
아 지루하다 주인공이 엄청 심각한 상황인 건 알겠는데.. 중간에 나옴,1
"네이버  시키야  이게  무슨  스릴러, 서스펜스야...!!",1
스릴러.서스펜스.. 이 두가지는 뭔! 생각으로 지어 낼걸까요?인간으로써.. 책임감 있게 삶은 살아야 되는거지만... 이건 아님!!!,1
이런것도 영화라고. 참. 쓰레기 영화임.,1
남이 차안에서 전화통화 하는걸 90분 가까이 구경하고 있으라고? 폰부스는 명작이라 생각하지만 이 영화는 진짜 장난하나,1
BMW광고영화. 끝. 톰 하디 돈 참 쉽게 버네. 영화에서 뭘 얼마나 느꼈든 그건 어디까지나 개인적인 취향차이.,1
저예산 영화든 제한된 공간이든 상관 없이 영화자체가 지루하고 재미없다.재미있게 본 사람들은 뭐라할 생각은없지만 평을 보고 영화를 볼 사람들 생각도 해줘야지...너무 무책임하네...,1
그냥 차안에서 전화질만하다 끝나는 초저예산영화. 이젠 이딴걸 영화랍시구 봐야하다니. 감독이 넘뻔뻔하네,1
"결론은 아내몰래 바람핀년이 임신했는데 출산일이야 그런데 중요한 공사까지 겹친게지..현장 총책임 감독관이라는 작자가.,.그런데 일보다 나올 아이가 중요하다면서 때리치고 바람핀년한테 차타고 가..끝~모같은 것들이 연기며 감성이며 두둔하는데 그냥 지루해~",1
"보는내내 지루하다,,차라리 폰부스를 한번 더 봐라,,이런류의영화가 국내에 수입되는이유는 단 하나,,bmw 홍보,,bmw를 타면 다른여자와 맘껏 놀 수있다,뭐 그런거다,,",1
이렇게 지루한 영화는 참 간만에 본다 진짜. 더럽게 재미없네.. 베댓부터 시작해서 영화보는 안목 높은척들 하느라 난리들 나셨어 아주.,1
영화 볼 줄 아는척 까부는 인간들이 참 많구만...,1
....돈주고 보기 아까운 영화,1
기대하고 보면 재미없음,1
좀 실망임곰이귀여워서. 테드원은 재밌게잘봤었는데 이번영화는좀재미없고식상했음그냥곰을 사람처럼살게하려고 하는이야기인데좀 식상함 괜히봄,1
핵노잼. .너무기대를해서 그런가..,1
인권을 가장하지만 인권을 철저히 무시하는 영화~~그래서 시간이 아깝다고 생각한 영화,1
욕은찰지게 아주 잘함 욕만잘함 나머진 미국식문화와 패러디로 뭔소리하는지몰겠음 10점주는사람은 미국살거나 살지도않으면서 아메리칸드림 이란 허황된 허세를 품고살아가는 김치녀놈. 사만다는이뻣다 끝,1
다10 점이길래...다큐보다 지루한 영화,1
이게 그 미생 깽판쳐놓은 인간 작품인가,1
tv 전기세가 아깝다!!!,1
진심 여태껏본것중에 최악 최악을넘어선 쓰레기 개그물만드냐 딱 중2이하 수준이라 말을 잃엇다,1
지드레곤 따라쟁이 ㅋㅋ 노래 진짜못함 얼굴도진짜못생김 연기도 진짜 못함 솔직히 사람들은 러브라인이 보는거다.,1
참고 보려했지만...  미안~ㅠㅠ,1
제가남자주인공을좋아해서그러는것도아니구요머여주인공이예뻐서질투하는것도절대아닙니다걍여주인공비호감이네요연기도어색하고다른배우들연기에묻어가는듯....,1
ㅈㄴ 오글거려서 못보겠음....개뜬금없이 노래하고  이상함 냄새남,1
자막 만든 놈아.. 실력이 없으면 그냥 만들지를 마라... 개버러지같은 능력으로 깝죽대지말고 어머니 잡아다가 칼로 찌르고 죽여버리기전에 쓰레기자식이...,1
밋밋하네...,1
평점보고 봤다가 허무하네 그렇게 감동이었니 ?,1
평점조절위원회,1
1편과 같은 감독님이라 보았는데...긴 말안할게여 ㅠ.ㅠ,1
애부터가 소년처럼 안생겼음 ㅋㅋ,1
연기 진짜 못하네...ㅉㅉ,1
지금 티브이에나와서보는데ㅡㅡ야할려면 야하든지ㅡ참 어색하다어삭해 연기도 스토리도,1
허세넘치는 대사와 연출. 80년대 영화같은 촌스러움을 고수하는 이유가 무엇인지 끝까지 이해못하겠다.,1
비주얼이 심하게 너프됐다,1
비쥬얼 너프가 너무 심하다,1
"전작 녹색의자보다 비주얼로 보나, 내용으로 보나 몰입하기 힘들었어요.. 계속 서정과 심지호만 생각났네요.",1
여주인공만 인상적인 영화 한때 어미라는 영화로 당시로선 파격적인 스릴러를 선보이신 박철수 감독님이지만 역시 세월의 속도를 못따라가신듯..연출 대사 영상 연기...모든부분이 어색해서 자꾸 스킵하게 되네요,1
그냥재미없음;;;;,1
별한개도 아깝다.저따위 몸으로 이런영화를 찍은 배우의 용기가 대단하다고 생각한다.마르기만하면 되는줄안다.전작을 따라가질 못한다.서정이 생각나는건 나쁜인가?,1
스킵하며 중요부분문 봤다.  잘 기억 나진 않지만 전작에 비해 배드신이 적은 것이  아쉽다. 좋지 않은  연기지만 OOOO 에로 치고는 연기가 고급니다.,1
박철수 감독님께 대신 사과 말씀 드리고 싶네요.,1
남자주인공 오글거림..우웩. 그리고 이런상황이 현실에서 일어나냐? 난 구경도 못함.,1
솔직히 안넘기면서 본사람 몇이나될까?ㅋ 실화던모던 이걸 나쁘게도 표현하는 영화의 수는 적다는게 씁쓸하다,1
.....,1
?....?흠....,1
Tvn 이것들은 재방은 절대 제시간에 안함 개 쓰레기들 그리고 지들이 뭐된다고 재방도 전부 유료야? 안보고말지...직원들이 새벽엔 전부 쳐자나봐 시간이  30분 넘게 차이가나니까 나도 저런 직장 다니고싶다 대충해도 월급주는데...,1
유세윤 뵈기시러 snl 안봄 .,1
솔직히 말해서 시즌2가 전편다 재미있고시즌3 유세윤편빼고 전부 형편없다,1
요즘맘에안듬,1
저질에로만 가는구나 곧 망하겠어 클라라 애는 말로만 의도적노출아니라고 하고 내놓고 노출만하고 있네 이중적이야  가슴만강조하고 질린다,1
오늘 너무 실망이군요...무슨 클라라 라는 사람은 나와서 몸만 노골적으로 보여주고ㅡㅡ 거의 대부분의 코너에 나와서 그러고있으니,1
봉태규 김완선 오는조동혁 편까지 왜이렇게 재미가없죠? PD가바뀐건지 작가가바뀐건지 소재고갈인지인간의조건으로 가야하나? 한번도안빼고본 SNL긴장좀하자,1
아....진짜 관객 드럽게 시끄럽네.... 못볼정도로,1
방청객이 더 신경쓰이는 방송은 내생에 처음,1
ㅡㅡ,1
정말 너무나도 못만든 영화..,1
역시 재미없네요 이게참나,1
한심한 영화 ㅉㅉ,1
이걸믿나? 우매한 군중들.. 쓰레기같은 정치관련영화,1
내가 감독이라면 다시만들고 싶은 소재,1
특수효과 장면이 암울합니다...한국영화 기술의 암울했던 과거,1
정말 쓰레기...정치성이 너무 강하고.. 조작사건을 영화화..--,1
개봉당시 안땡기는데 여친이 보자고해서 봤는데 이민기만 불쌍한 영화.. 김고은 연기는 최악,1
ㅅㅂ 이게 영화냐? 시가아깝다 인생에 기집에 쳐 우는거에 ㅅㅂ 시간다간다 황감독 앞으로 니영화는 안본다,1
아니 이건뭐 마지막에 싸울때 어두워서 뭐어떻게싸우는지보이지도않고 알수도없네 출연진이랑 감독이랑스텝만본거임? 재미없게만들엇으면 마지막장면이라도 좀제대로보여주던가 뭐 이렇게영화를만들수잇는거지??,1
이딴 시나리오도 돈들여 만들 생각을 한 감독님이 가엾을 지경,1
한국인들은 10점하고 1점밖에 줄줄 모르나...;;볼만한 초중반 난감한 중후반.,1
죽도 밥도 안된 영화..,1
안타까움~ 같이 보러간친구가 도저히 재미없어서 못보겠다고해서 도중에 나와버렸네요~~,1
이민기가 가게 안에서 살해하는 장면만 영상이나 뭐 그런 연출한 분위기만 괜찮았다. 김고은과 아이의 대화하는 연기 보는내내 짜증났으며 뭘 이야기 하는건지 도대체가 알수없는 영화다. ㅂㅅ같다. 한마디로.,1
감독이 기억상실증인지 앞뒤가 하나도 안맞음. 본인이 찍어놓고 기억을 못하는건지... 영화 계획하고 찰영하고 편집하는 동안 어디 딴데있다가 와서 슬쩍 감독이름만 올린건 아닌지 의심스러움.,1
감독부터 시나리오쓴것부터 잡아족치자 이렇게 연기잘하는  사람가지고 장난친거지? 김고은연기때문에 끝까지봤다,1
보는내내 여자애들둘이서 징징대기만함,1
티비에서 보는것 조차  시간 아까운 영화,1
어휴...답이없다.,1
배우의 연기력만 보고 평점높게 주는건 나쁜게 아니죠하지만 저는 스토리를 우선으로 보기때문에 낮게줍니다..,1
텔레토비가 더재밌겠다,1
반개도 아깝지만 줄수밖에,1
이거 왜 만들었냐 돈 아깝다,1
음 평점보고 볼걸 공짜로봤지만 그래도 스릴은 있었음,1
감독님 지금이라도 늦지않았어요 감독때려치우고 다른길 가세요 이런 영화에 어떻게 투자를받고 개봉했지 ? 어휴...,1
이걸 영화관서 돈주고 보신분들 감탄이 절로 나옵니다.,1
살인자vs바보년이네,1
별점 반개도 아까움 걍 짜증만 나는 영화.짜증나서 감독 찾아봄누군지 ㅡㅡ 아 걍 짜증남 진짜 싫은 영화,1
