슬혜씨.. 벗으려면 제대로..,1
내용도 없고 느낌도 없고 공기같은 영화,1
감독 이런 영화로 인기끌줄 알았나 어차피 망할게 뻔히 보이는데 왜 이딴영화만드냐,1
이런 변태같은 스토리는 흥행하기 힘들다 이딴내용으로 인기끌려고 했나,1
평점보다 더 구리다... 만든 목적이 뭘까? 한번도 안해본 사람이 언제부터 흉이었지?,1
감독이 누군지정말 궁금함 배경이며 캐릭터며 옛날틱하고 시간아깝고 돈 아깝고 제목만자극적이면 다인가,1
알 수 없는 영화....!!,1
장르가 먼지도 모르겠구 황우슬혜 몸을 너무 아껴서 아쉽네,1
시간 떼우기용으로도 별로였던 영화.,1
촬영 장면등이 싸구려 영화같은 느낌이 난다랄까... 비디오캠으로 찍었나..,1
제목과 다르게 해본여자 같은데?,1
뭘얘기하고싶은 영화인가요?,1
별도아깝움드럽게잼때가리읎음 돈만아까움OOO영화왜만듬?더랏나 아짜증나,1
이따구 영화를 왜 만드는겨?,1
역시 안해본여자보단 해본여자다,1
10자이상 작성하기도 아까운영화 그러나 1점을주려면 어쩔수없음,1
할 말이 없다. 뭔 생각으로 만든거지?,1
"정말 이러시면 안되는거잖아요.. ─━,,──━ㆀ",1
헐랭 .. 한마디하고싶자는~~~~,1
"고등학생들이 만든 영화보다 못할꺼같은데...야하지도 않고, 재밌지도 않고, 감동도 없고, 무언가 임팩트도 없고...관객을 무시하는 듯한 영화",1
비디오대여점이 없으니~~~,1
내가만들어도이거보단.잘만들듯.,1
이게 평점이 3점대? 1점대가 적당하다,1
"맛있는섹스 그리고 사랑,연애의 목적,청춘처럼 화끈하게 야하던가 하녀처럼 그리 야하지않더라도 내용이 있던가 이건 전혀 청불도 아닌데 청불이고 내용도 없고..",1
반점 해장국 반점 열자이상 등록,1
성에 대한 호기심을 자극하는 제목과는 따로 노는 내용과 전개,1
이건..알바도 반박불가 ㅋㅋ,1
감독이나배우나  투자한 제작사나  배급사나  무슨생각인지...,1
평점 자체가 우습다는 생각 연기도 연기지만.. 스토리도 진부하고 그스토리를 가지고 만든 감독도 한심하다..,1
아무리 영화라지만 정서상으로나 말도안되는 스토리네,1
하시간아까워내눈...내시간...,1
아버지가 돌아가셨는데....이야~이건뭐   참....이영화  정체를밝켜라!!!!,1
돈내고 보면 땅을 치고 후회함 진심임,1
아... 47분봤는데 진심 재미없다... 뭘 보여주고 싶은거냐,1
무슨말이 더 필요할까나...,1
아.. 평점 1점 드리고 갑니다 아..물론 영화는 안봤습니다 한번도 안해본 여자라는 제목은..SF물보다도 현실성이 없군요..차라리 촉수괴물 나오고 킹콩이나와서 건물을 때려부수는것이 현실성 있겠습니다...그럼이만,1
스토리라인 자체도 별로 맘에 안드는데다 배우들 연기가 너무개판이라 도저히 볼수가 없어서 꺼버렸다.. 황우슬혜 연기 정말 안느는구나 싶었다.,1
시덥잖은 이야기면 웃기기라도 했어야지,1
이야기의 주제랑 너무 많이 벗어난 것 같다.,1
무색 무취(無色無臭),1
황우슬혜는 발음 연습 안 하나? 혀짧은 걸 매력(?)으로 강하게 어필할 모양?,1
평점 보고 볼껄~ 시간 아깝 ㅠㅠ,1
두여배우도 배역에 안맞아 보이고 제목만 자극적인 평범이하,1
개쓉노잼 차라리 이시간에 ㅇㄷ보고 ㄸ을 쳐라 황우슬혜 벗지도않음,1
아.... 너무하네요.... 대학생 졸업작품 보는 기분이었습니다..,1
아놔 영화 영자도 모르는 내가 만들어도 이것보단 낫겠다. ^^; 이런거 만들거면 안 만드니보다 못한거야. 좀 한국 영화 수준 후퇴 시키지 좀 말자...,1
보고잇는거 자체가 시간낭비다. 이러니까 상영관도 없이 개봉ㅂㅂ 햇지. 영상전환 하며 연기하며 스토리하며 걍 독립영화보다도 못함. 대학교 영화동아리가 찍은영화라해도믿을정도로 허접OOO,1
황우슬혜의 어수룩한 매력의 캐릭터가 중심을 잡고있지만 맨 처음 콘셉트와는 전혀 무관한 방향으로 흘러가는 애매모호한 전개,1
웃기지도 안코 야하지도 안코  3류들이  모여 만든 3류영화,1
1점도 아깝습니다.. 공감좀..,1
개졸작,1
시리즈는 거듭됨에 따라 식상함이 느껴지지만 왠지 모를 중독성이...,1
폴리스 아카데미3-재탕,1
시걸이형한티 총잡는 자세부터갈켜줘라 ㅋㅋㅋㅋ,1
대체 돈이 얼마나 남아돌아야 이런걸 찍을 수 있는겐가.,1
"ㄱㅐ시ㄹㅔ기 영화, 별 한개도 아깝다",1
시갈이 왜 3류 액션배우인지 다시 한번 확인하고싶은 사람 보세요,1
시걸이 허접액션 그만 좀 찍어라 어휴~,1
언더시즈 이후로 몇OO동안 몇십편의 영화가 전부 쥣망이네..ㅋㅋ이형님 왜이리 됐냐..ㅠ.ㅠ,1
재미없음,1
기대를 충족해서 늘 그렇듯 흔쾌하게 만족하다.,1
시간이 아깝던 쓰레기영화,1
황당무개한 스토리...,1
네래 이 종간나 색히들 쏘레기 영화에 원자탄을 까주갔어,1
남친이랑 볼거없어서 젤가까운게 이거길래 봤는데 자살하싶었음,1
ㅠ저누너너터냐냐너너어 쓰래기!?,1
비뚤어진 시각교묘한 역사왜곡,1
재미없어서잤습니다.,1
보다가 잔영화 진짜 오랜만이였떤걸로 기억..,1
시나리오가 뭐 이래!!! 짜증만 가득!!!,1
너무 영화에서 욕이 절반이엇던것 같음.  몰입도안되고 별로..,1
내가 본 로버트 드니로 작품중 제일 재미없었다. 엔니오 모리꼬네의 음악만 기억남는다.,1
원주민에 입장을 본 적이 없다,1
싫다는데 억지로 먹이고 먹은 사람은 가만히있는데 옆사람들이 서로 옳다 맞다 싸우는 내용. 아 기독교 영화는 왜 항상 자기들이 옳다는 생각에서만 다루어 지는 것인가...,1
내가  보아도 서구중심적인 부분들이 많다.평론가는 평론가의 입장에서 각자의 평을 내놓는것이다 그것을 편견과 오해를 심어 내던지는 당신들의 생각이 전화하는 점이 독단적인 시각이 편견이라 생각한다. 비판과 화합을 보는 이가 없는 것이 마음아프다,1
존트라볼타 디스코 잘춘다,1
저시절을 안살아서그럴까?춤도안멋있고 구성과 흐름도 유려하지않다 평점넘높음..,1
제작시기를 감안하더라도 너무 안이하게 제작된 영화,1
존트라 볼타 혼자 춤추는 장면 1분 빼면 볼게없다. 추억의 영화니까 뭐.,1
클린트 이스트우드 영 허접,1
"지나친 엉성, 멍청, 유치함에 놀라 팔짝 뛰며 화를 내다 기어코 속이 뒤집히다.",1
존 트라볼타 때문에 2점,1
날라리는 멋진사람이고 순진한 사람은 바보로 묘사한 영화,1
"문화가 달라서 이질감이 들긴 하지만, 노래하고 춤추는 장면은 신나",1
올리비아 뉴튼 존에게 홀딱 빠진 날들. 노래만 듣자. 별 거 없삼.,1
뮤지컬 영화는 싫지만 노래는 좋다,1
너무 느끼한 존 트라볼타. 음악도 별로에 스토리도 막장.,1
"가슴 저미는 감동..,,",1
음...뭐랄까요..전개가 막무가내식으로 밀고나가며 결국엔 결말이이상합니다. 다보고 나서 느끼는 딱 한단어 '그래서 뭐' 보고나서 남는게 없습니다. 송강호씨 주연의 변호인보다 훨씬 못합니다,1
억지스러운 전개....,1
오늘 ktx 영화칸에서 봤는데 넘 재미없음..,1
재밋냐 이거 별로같은데,1
한국말 무슨 국어책 읽냐...  답답하다 진짜,1
그냥 몰래 오키안리누나 다운받아서 보세요. 영화값이 아깝습니다. ㅜㅜ,1
..예산이 아까운 영화다...왜봣지,1
.... 한국 유학생들이 이렇게까지 대우 받아야 함?... 방사능 처먹고 할 일이 없는듯....,1
노잼임 한국어진짜못한다 ㅋㅋ,1
OOO기. ㅋㅋㅋ진짜 볼것도없고재미도없고.. 처음엔 잘 보다가 나중가선 걍 스킵스킵스킵함ㅋㅋㅋ,1
재미없음. 볼거리도 없음.,1
뭐하자는 거야...한국어도 진짜 말도 안되게 못하네..,1
골때린다 진짜 ㅋㅋㅋㅋㅋㅋ,1
한국말 못봐주겠다 책읽냐,1
'애정결핍이 두 남자에게 미치는영향' 이라는 영화랑 스토리 전개방식이 매우 유사하네...,1
이건 지능적 혐한영화. 대놓고 한국여자를 OO로 비하하고 있다. 그나저나 한국에는 K컵이 없을텐데? H컵도 여자전체의 0.001%도 안되는데 이게무슨 디스토션. 원래 평점1점감인데 오키타안리때문에 3점준다.,1
...쓰레기...,1
1점도 아깝고 한국어가 안되면 차라리 한국어씬을 찍지말든가.,1
눈물나다.,1
북조선에서 온 스파이랰ㅋㅋㅋㅋㅋㅋㅋㅋㅋㅋㅋㅋㅋㅋㅋㅋㅋㅋㅋㅋㅋㅋㅋㅋㅋㅋㅋㅋㅋㅋ,1
재미없긴한데.......걍중간에 보다가 안봤음ㅋㅋㅋ 한국어연기 대박이고ㅋㅋ,1
일단 재미 없다.밑에 있는 분들이 재미 없음은 이야기 했지만..솔직히 ...망상과 침략이라는 느낌은 없었다.차라리 우리나라 영화중에 재미없게본 애정결핍이 두 남자에게 미치는 영향 이라는 일본판 영화라는 정도...일본 배우들의 한국어 연기는 정말 과관.,1
재미없다.. 영화한편보길 침략이 어쩌거 한국 디스걸었느니 ㅉㅉ 한국영화는 죄다 9~10점줬네 매미OOㅉㅉㅉ,1
안본걸로 하고싶다,1
일본 애들은 망상과 침략 이외에는 생각이 없다고 스스로 얘기하는 영화,1
이영화 장난하나 ㅡㅡ,1
욕해도 되나??이거 한국을 디스하는 영화네.1점도 아깝네.ㅡㅡ,1
ㅋㅋㅋㅋㅋ미치겠네ㅋㅋㅋㅋㅋ,1
마에노토모야 싸우자는거냐?,1
원주율로가는거야?,1
뭐여...일본말로 하든가...그리고 설정이 왜 기분나쁘게 한국유학생이냐..재미도 없고 짜증만 나더이다..,1
4류 영화.. 정말 말이 안나온다..,1
아...이건아니야,1
일본판 송은이닮은  아들놈과  고창석닮은 아버지의  말도안되는  가족얘기 ㅋㅋ  어이없는  영화,1
일본 사람이 한국말하는데 진짜 오글거린다,1
대단한 영화다. 이렇게 만들기도 쉽지 않을듯한.,1
할말이없다..,1
나이가 들어서 그런지 유치하기만 하네. 페터슨 감독이 이런 영화도 오~,1
"당신이 어른이라면 보지 마라, 이런 영화는 추억으로만 남아야 한다",1
옛날CG영화특유의웅장함을기대했건만신비주의포스터에 속았다어른이보면 정말시간낭비,1
이작품만의 독특한색깔은 지녔지만 전체적으로 어설픈느낌.. 재미가없다,1
도데체 세상을구하겠다는데 무기를쓰면왜 안된다는거지,1
내가 나이가 아직 안돼서 공감을 못하는건지는 모르겠지만 보는내내 여주때문에 짜증만 났던 영화 주변사람하고 톰한테 피해만 주고....마지막장면은 무슨 의미가 있는건지 잘 모르겠지만 보면서 짜증났던 영화,1
재미없어도 마지막 반전만을 기대했는데 반전은 개뿔... 아무것도 없었다,1
젊은시절 베닝은 이쁘더만...,1
너무좋네요좋아요^^,1
보는 내내 시원한 청량음료가.너무 간절 했습니다.,1
인간적으로 이건 크리스마스애니메이션이 아니라 불륜애니임 아니어떻게 지 아빠가 살아있는데 집에 안온다고 당당하게 불륜을 저지르고 남편이 살아있는데 남의 자식을 낳는단게 말이되는거여??!! 진짜 화나네,1
제발 개그맨 아이돌은 목소리연기도 시키지 마라. 들을수가 없다 들을 수가...,1
이상한내용과전개...아빠는 일만하는 일중독자에 엄마는 그래서 다른남자를만나고 니코를 데려와 다른남자와 살림을차림. 어이없음 ㅡㅡ,1
볼만하다..8점짜리..그러나 쓰레기 한국어 더빙때문에 1점준다..,1
"바쁜아빠 때문에 엄마는 바람피고 애기 놓고.. 영화 끝.도대체 뭐가 감동이고, 재미가 있는지..",1
목소리때매망첬네 ㅡㅡ,1
...........,1
완전 쓰레기 영화.. 열심히일하는 아빠놔두고 바람피는 엄마사슴얘기.. 아들이랑같이 보는데 어이가없어서 정말.. 아이들이 뭘보고 느끼라고 이따구 영화를 상영하냐 돈벌레들아,1
6살아이와 봤는데 애니메이션인데 볼수록재미없어함...근데 정말 재미없었음,1
"왠만한 애니매이션은 재미있게 보는데... 러닝타임 너무 짧고, 내용이 너무 없어서... 이게 뭐야 하는 순간 영화 끝;;;;;",1
너무나도 진부하고 식상한 스토리,1
주인공들도 별루고 내용도 뻔하고,1
지금보기는 좀 아니네요..눈위에서의장면은 한번쯤은 다 봤을장면,1
남녀 주인공 비주얼도  별루 내용은 청승맞고 음악도 빌리티스가 훨씬~ 좋다...,1
음악만 좋았다 내용은 정말~~~~ 별루다  점수조절차원에서 1점,1
재미가 너무없다.가나,1
아이가 영화보다 나온건 이게 처음,1
차라리 출연시킬꺼면 트리케라톱스나 티라노사우루스 출연시키지..인기도 없는 파키리노사우루스하고 고르고사우루스를??,1
예전 다이노소어란 애니메이션의 딱 절반수준,1
유아와 함께 보심이^^,1
더빙 ㅜㅜ 최악이였네요~~~,1
대사를 빼라...대사를 빼라....,1
제가 10대거든요..근데 참 재미없네요그래도 기린광수 덕에 3점 드립니다.,1
아이가 마니 좋아합니다,1
재미진짜없다점박이가훨씬났다,1
뭐랄까..그냥 기대이하다.,1
성우들 구림. 전문성우들 많은데 아쉽네요.,1
전 개인적으로 별로였네요 아동용에 왜이리 열광하는 줄 모르겠네요,1
로잼이다ㄱㄱㄷ싖싖ㅅ,1
솔직히 캐릭터빨스토리는 그지같음,1
스토리 없고 엘사가 어떻게 초능력 가지게 됬는데?,1
디즈니의 거듭되는 퇴보,1
한 나라의 여왕이 저리 책임감 이 없다리 그리고 여왕의 동생인 사람도 처음본 왕자와 결혼을 하려고 하는 정신나간 여자임. 뭐하나 스토리의 개연성이 없으며 결말또한 정신나갔다.  진짜 씨쥐와 노래 빼곤 건질게 없는 최악의 애니메이션임,1
역대 디즈니 시리즈중에 가장 감동없고 최악이었음. 극장에서 보는 자신이 민망할정도.,1
노잼노잼노잼노잼노잼,1
진짜 뭐가 재미있단거임?노래는 괜찮은데 캐릭터가 같이 부르니깐 ㄹㅇ유치하더라 9점대의 점수가 나온게 신기하다이 정도면 평균4점은 되야할듯,1
"재미드럽게도없네 내용이이게뭐냐,, 평점이왜이리높음?ㅋㅋㅋㅋ쿠 솔직히 좋은건 노래밖에없지않나",1
교육적이지도 않고 메세지도 없고 재미도 없는 영화화가난다!,1
그나마 나았던 노래마저 초딩들과 프폭도가 망쳐논 비운의 영화. 지긋지긋한 렛잇고를 불러대는 프폭도들 때문에 노이로제 걸린다. 아직도 이게 명작이라 생각하는 사람들은 정신연령이 유치원 졸업도 못한거임.,1
완전 기대 이하,1
개인적으로는 재미없네요,1
아이다 진짜,1
뭔말인지;;;,1
잼없음...,1
"하핫...? 이게 대체 먼내용인지,,,",1
어서와 별점테러는 처음이지?,1
어서와 ! 오스트리아영화는처음이지? (저 포스트 동상의 표정),1
픽사 애니메이션을 매우 사랑하지만 이 작품은 글쎄. 이건 어른들이 보기에는 좀. 카의 번외편 수준도 안 되는 느낌. 픽사 애니메이션 중 흔하지 않은 실패작,1
애들이 보는거여서 별로 재미는 없었다.,1
멋진 그래픽과 깜찍한 캐릭터들이 흔해빠진 스토리를 만나 결국 어린이 전용 애니메이션으로 전락하고야 만다!,1
아무런 감흥없는 어설픈 우려먹기,1
ㅋㅋㅋ 3류영화네 유딩전용,1
만화영화에서는느낄수없는,1
"네이버 평점/리뷰는 정말 알바들이 쓰는건가 ? 여기 있는 평점/리뷰 보고  봤는데 정말 영화 별로더라. 미도, 감동도 아무것도 없는 영화 그냥 그림만 괜찮게 그려놓은 영화. 보실 분들 참고하세요. 왜 빵점은 없는거야?",1
어.. 왜 더빙이냐고 다...ㅠㅜ,1
쓰레잌ㅋㅋㅋ 영화 알바 좇되랔ㅋ,1
"유치한 스토리는 참아보겠지만, 그보다 더 괴로운 테러급 더빙. 니모를찾아서를 닮고자 한, 아동판 원더풀데이즈.",1
"그냥 꼬마들이나 봐라,,,",1
"진짜, 상어, 코델리아는 더빙 졸라 못하더라. 진심.",1
제발 연예인 더빙 사라져라,1
트로이랑 코딜리아목소리 진짜 미스캐스팅이었음,1
솔직히 까고 말할께. 니모로 부터 시작되서 바다이야기 나오는 애니는 수십번을 봐왔어.이제 그만 나올 때도 됐잖아.그리고 제목이 '파이이야기'인거... 'LIFE OF PI'랑 같이 뜨고 싶어서 그런거지?,1
OO 상어가 동네북이냐. 역사상으로 따지면 3억년 가까이 바다를 휘어잡았는데,1
에휴...,1
쓰레기 한국어더빙.. 때문에 1점이다..,1
"더빙 정말 최악이다. 안어울리는 목소리에, 발연기,, 정말 최악의 더빙.. 듣기가 싫다. 오그라들어..",1
7광구가 더 나아요~~,1
ㅠㅠ보다잤어요ㅠㅠ,1
ㄱㄱ,1
아르바이트가 존재한다는 느낌을 지울 수 없는 영화입니다. 20년전 영상미를 보여주는 영화 시종일관 지루했습니다! 중간에 나가는 아이들도 몇 몇 있더군요.,1
도가 지나치게 재미없다,1
스마트폰으로 내가 만들어도 이것보단 잘만들겠다 ㅡㅡ;;ㅋ,1
제점수는요 1점입니다,1
이게뭐고 영화가 보다가짜증나사못보겠더라,1
영채가 나와도 tv 전기세는 아깝더라...,1
이게뭐지 도데체가,1
시간낭비. 지루함. 도대체 뭘 본건지 모르겠음.짱나.재미없음.오죽하면 로그인했을까......아......짱나.아.ㅉㄴㅉㄴㅉㄴㅉㄴㅉㄴㅉㄴㅉㄴㅉㄴㅉㄴㅉㄴㅉㄴ,1
쓰레기라는 말 써주려고 로그인까지했다. 정말 멘탈이 썪어가는 기분이다빵점주고 싶은데 빵점을 못주게되있어서 1점준다,1
이 영화가 주는 교훈은 뭘까.. 저토록 찌질한 남자를 놓지 않는 여자 또한 정상은 아닌 것 같다.,1
재미읎네 ㅋㅋ,1
와...저런 찌질한 남자에게도 여자가 관심을 갖는다는거에 희망을 갖는다 쩝,1
욕때문에 더러워서 꺼버린 영화,1
별주기도 아까운 영화......................솔직하다 못해 저질 스러운 영화,1
완전 재미없음,1
드라마스페셜 보듯..,1
줄거리와 내용이다르다...어지럽고 연기도 화면도 시트콤찍냐?,1
이도 저도 아닌 어중간한걸 본 느낌 ...,1
진짜 연기못하는것들 모아다가 뭘 찍는지...,1
한심스럽다,1
동닷에나와서봤는데 글쎄..,1
이건 대체 뭐냐.. 내가 뭘본거냐,1
공짜포인트로 다운받아 잘봤다. tv단막극만도못한 요런걸 영화랍시구 내놓으면 누가 돈주고보니? 실없는 말장난이나 대사랍시고 너저분 산만 퀄리티가 넘떨어지네..,1
도대체 뭘 어쩌자는 거지?,1
이렇게 재미없는거 처음봄....자연다큐가 더 재밌겠다,1
"전개 방식이 독특해서 2점. 그걸 빼고나면 습작수준. 더불어, 의도가 뭐였건 여성의 순결에 집착하는 모습은 풍자를 넘어 참고보기 힘들정도다",1
다봤는데 속사정은 언제알려주나요,1
제목부터가 참,1
에휴...뭔 넘의 군더더기가 이렇게 많냐 ㅉㅉ,1
제목바라 ㅋ ㅋ 일본애니 제목 교묘하게 바꿨네겨우 저정도 제목을 표절하나 이 쓰렉기 제작자야,1
한국 영화계가 어느 정도로 타락했는지 참으로 잘 보여주는 영화이다. 세 명의 남성중 누가 이 여자와 관계를 갖는가? 이것은 세상을 타락시키고 사람들의 무의식속에 음란을 즐기도록 인식을심는 영화이지 인간의 고귀함이나 순결의 가치등은 조금도 찾아볼수없다,1
"솔까 돈주고 보기엔 아깝다.     집중해서 보지 않으면 내용이 너무 산만하게 설정되어 있는 느낌이 있고,,      유독 한명이 너무 찌질해서 내용이 너무 질려버리는 경향이 있음..  장점이라면 그남자덕에 나의 어린시절을 되돌아 보게 되었다는 정",1
일단 화질부터 개 망 에로비디오 수준의 화면질구성,1
제목 표절 안하고 만들순 없나?,1
"차라리 애니 그 남자ㅡ그 여자의 사정을 한번 더 보고 만다...이토록 창의력없는 제목에 걸맞지 않는,제법 매력 통통튀는 여배우.그러나 나는,네모토 하루미같은 거유 타입을 좋아하므로,별 관심 없음.수정이는,정답입니다~의 수정이나,여배우 임수정이 제일이지",1
최악 보다가중간에나옴,1
재미 더럽게없네 2점부터 점수준거 매미OO,1
예전에 봤을 때는 그냥 신선했는데 지금 다시 보니 유치함의 극치..,1
건질 거라곤 주제가밖에,1
유치하고 지루하고 진부하다,1
이미 머쉬멜로우 맨이 나온다는 설정 자체가 엉터리.,1
해롤드스미스는젊었을때크리스찬베일닮앗네너무오래된영화라지루하고거의우뢰매수준,1
꽝,1
머가 재미 있다는건지 혐오스러운 음식 케릭터기승전결없는 스토리 시간이 아깝다 진짜 일베충 평점보고 속았다,1
솔직히... 쓰레기...,1
소니에서 만든 애니매이션은 예외없이 산만하고 실망스럽네..,1
전편보다 별로임. 완전노잼.끝까지 보는게 벌스는 수준....돈아까움,1
음식들이 귀엽지 않고 혐오스러웠다외국인이 번데기 음식 보면 이런 기분일테지...스토리도 너무 평이해서 매력없음,1
유치해서 못봐주겠음.. 1두 유치찬란 했지만.... 얘들 만화니 참아야지,1
애들조차 재미없다고 할정도로 졸작이었다.그래픽이나 특수효과와는 무관하게 내용이 너무 유치하다. 애들 수준을 너무 낮게 잡은거 아닌가?,1
유치원에서 초등저학년이 보면 좋아할 듯.,1
기대이하였다.. 애니메이션의 한계,1
...!..!...,1
비맞아서 여주 OOO보이던데 왜12세에요??ㅋㅋ,1
왜 별 0개는 없는거죠? 유플릭스로 봣는데 평점 1이 되어잇길래 살짝 불안햇는데 초반에 해일이 자동차 덮치는 장면 CG보고선 딱 감이 왓음 ㅠㅠ 살다 살다 이런 영화 처음임 ㅠㅠ,1
늬들이 잘못봐놓고 올레tv탓하지마;,1
"최악이다....,....",1
"최악,  1점도  아까운  영화",1
영화부류. Sf.판타지 ㅋㅋㅋ 판타지소설을 모티브로한 판탄지내용을 첨부한 말그대로 판타지영화,1
쓰레기 영화. 보지마세요,1
졸라재밋네 올레티비 돈내나라,1
노아는 무슨 찟긴데는 은박지 꾸겨놓고 아주 최악의 영화임.내 4000원!!!고치는건 불빛으로 하나 건드리고 다 고침...뭐지,1
"내 생애 최고의 영화, 추천 안합니다.",1
절대 안보시는것이 ..ㅠㅠ,1
예고편만으로 영화가 보인다.,1
진심 왜만든 영화냐 그냥 내려라,1
ㅠ 1점도 아깝다 진짜 ㅠㅠ   솔직히 내 점수는 0.01 최악의 영화,1
Btv가 나한테 똥을줬어 똥을줬다고ㅡㅡ,1
완전쓰레기영화임 그래픽 다 티남 노아 볼 시간에 목욕 하고  세 수하고 자는게남,1
역시 사이비종교인이 만든 영화와 하나님이 만든 영화의 차이는 여기서 나타나는 듯 노아는 쓰레기 영화.. 내용도 성경과 무관함,1
평점 보고봤어야 하는데  저만 느끼는게 아니네요.. 정말 허접스런 CG ㅋㅋ,1
진짜 영화좋아해서 봣던거30번도더넘게보는편인데...  이건뭐..정말시간낭비..내와인낭비..(영화보면서 와인마시는거좋아해서~^^) 일단 영상.그래픽티팍팍그리고 그 사각턱진여자 연기 ㅎㄷㄷ..내평생에이런영화는첨임~ 2012따라하고파안달인데 새발에피도안됨,1
와 살다살다 이렇게질떨어진 허접나부랭이를봣나.이딴걸 인기영화라고올려논 올레티비 양아치짓보소,1
올레티비로 보구있다.보다가 어처구니없어서 평점보러왔다.아~c 쓰레기네..,1
이게무슨영화에요ㅋㅋCG개떡같이해놈ㅋㅋㅋㅋ이거진심보지마세요돈아까워요,1
이걸 영화라고나참어이가없어 내가본영화들중에 가장최악이거  올레tv이걸인기영화라고  돈만 빼먹는놈들내8000천원 어캐할거임?  어떠게1960년대 영화보다못하냐?배우들도 연기가 어설프고 실망입니다.,1
낚인건가 말만 노아구나,1
열받네 올레티비....장난하나,1
별 ㅈㄴ아까움 0점 없음?,1
노아 짝퉁 아 정말짜증나 만화영화도 이보단 낫겠다...,1
최악의쓰레기영화.아 짜증..,1
스카이에서 하길래 볼라고했거든 근데 혹시나 재미없으면 어쩌나했는데 ㅋㅋㅋ안보길잘햇다 휴 ㅋ,1
어이~~쿡TV 양반들~~^^ 내 돈 돌리도 씨 부 럴....3류도 이런 3류가 있나..인기영화라고???완전 3류 에로영화보다도 못하네..혹시 느그들 빵 좋아하냐??죽 빵 한대씩 줄까?,1
하하하하.... 시대에 뒤떨어지는 CG 배역들.. 다.. 완젼 저급영화... 시작부터 CG를 발로 했네 ㅋㅋ 아...,1
진짜 완전 쓰레기영화ㅡㅡ 연기도 드럽게 못하고 CG도 어설프고 모든게 최악임,1
