슬혜씨.. 벗으려면 제대로..,1
"37년 더 넘어서 본 영화임에도.. 2015년 지금 나왔더라도 대박을 터뜨렸을 영화. 말론 브란도, 알 파치노.. 정말 최고의 배우. 영화 의 전체가 완벽하다. 대부2를 보면 자지러질 것 같다. 왜 이제서야 봤을까..",0
거부할 수 없는 부탁을 하지..,0
"옛날 영화는 구리다라는 나의 편견을 깨준 영화 , 10점으론 모자른 고전 클래식",0
10대에 이 영화를 보고 이딴게 대체 무슨 명작이야??? 20대때 보고 명배우 말론 브란도와 알파치노의 연기에 감동했으며 한참지난 지금  이 영화를 보고 가슴이 먹먹 해졌다. 수 많은 명장면과 명대사는 그냥 덤이다.,0
아 말론브란도... 이 영화를 이제까지 안보고 미뤄왔다니,0
1부만 보면  한편의 명작 느와르 영화를 본 느낌이 들지만 3부까지 보면 한 사람의 인생을 들여다 본 느낌이 든다,0
영화 상영시간은 인터스텔라 뺨쳤치만.. 하나하나 곱씹어 봐야할1분1초다.,0
아직도 말론 브란도의 쉰목소리와 어감 무게감이 느껴지고 배우들 연기하나하나가 명품 작품성은 말할것도없이 내가본 최고의 영화,0
대부를 안봤으면 느와르 영화를 논하지 마라.,0
말로만 듣다 보았는데 오늘 보게되었는데. 정말 시대의 명작이네요. 정말 천재적인 작품 같습니다.,0
빨리 2도 보고싶다...,0
내재된 분노가 얼마나 무서운지 제대로 깨닫게 됨,0
어릴대 tv로 본 대부는 내용도 잘모르겠고 그냥 지루한 영화로 기억한다.. 40살이 되어서 다시본 대부는 40살이 될때까지 본영화중 가장 기억에 남는 영화로 기억된다.,0
느와르의 정의입니다.,0
감히 평하겠는가 그 시대 최고의 명화다,0
남자가 안봤으면 제발 보세요 아니면 군대 다시가던가,0
175분이 너무나 짧게 느껴졌다.명대사며 명언이며 연기며 캐릭터까지 잊을 수가 없는 영화.초반부터 교훈적이 말들이 나와 정말 중독되었다.원래 봤던 영화를 또 보면 지루하지만 이 영화는 끝까지 보게 하는 영화다.내가 느와르를 좋아하게 되는 계기.책도 짱,0
"내 인생에 있어서 가장 많이 본 영화 대부 1, 2.2~3년 마다 보고 보고 또 보고 ....",0
내년에 39살 이 영화을 처음 본 오늘 감사합니다.,0
재밋진 않지만 고전영화의 클래식함은 아주 넘침 두 번 보면 좋을 영화임,0
말이 필요없는 영화ㅡ3부작 전부 정말 한 장면 한 장면 잊혀지지않는 명장면ㅡㄷㄷㄷ그 긴 시간 동안 버릴 게 없다 버릴 게!!!!,0
진짜 길이 길이 남을 명작입니다 다시 봐도 재밌네요ㅎ,0
최고다.. 왜 이제서야 이 영화를 보았을까,0
"마치 한편의 문학작품을 읽는듯한 엄청난 서사감 ㄷㄷ 말론브란도의 연기에 감동받았습니다. 얼른 대부2,3 봐야겠다 ㅎㅎㅎㅎ",0
배우도 명배우! 감독 또한 명감독! 이런영화를 놓치는것은 대단한 실수란것을 아시길...,0
20번 넘게 본거 같음... 근데 볼때마다 새로운 영화를 보는 느낌임...,0
아버지와 남성의 '숙명의 의무''에 대해서 비장하게 파해친다.,0
"말론 브란도, 알 파치노면 말 다한 영화 아닌가요. 대부 이후  느와르 영화들이 대부를 능가할 수 있을지? 대부만큼만 나와줘도 감사할텐데, 옛날보다 기술은 발전했지만 내용과 연출은 예전이 더 나은 것 같죠...",0
최고! 빠져드는 알파치노!^^,0
긴시간이 후딱~언제적영화인데이다지도 치밀하고 빨려들어갈수있나~최고다!연기?음악?젊은 알파치노~^^,0
평가 무의미‥ 이 영화는 한번보고 버릴 영화는 아닌건 분명하다,0
나이가 들면서 옛영화를 보면 유치하기 이를데없는데 이 영화는 시간이 지나며 더욱 진한 감명이 드는 영화 오늘 교육방송에서 방영했는데 잠이 안옴,0
20세기 최고의 영화~알파치노의 차가운 눈빛과 연기력은 소름,0
대비를 이룸으로써 더 극대화되게 다가왔고 최고다,0
"비토와 마이클, 1900년대와 냉전기의 미국, 두 편의 영화를 보는 즐거움을 선사하면서 강대국이 되어가는 초창기의 미국과 팽창주의 패권주의의 초강대국 미국의 모순을 대입시키는 스케일은 압권이다. 결국 코폴라가 미국에서 가장 위대한 감독이 아닌가 싶다.",0
청문회 장면은 꼭 다큐같았다,0
평론가 박평식의 9점.. 설명끝,0
전작보다 속편이 더 뛰어난 영화,0
걸작이라는 단어가 어울리는 몇 안되는 영화. 인생 힘들때마다 꺼내서 본다.,0
이거 한 200번 보니까 지겹네요. 대부3 보러가야지!,0
나이를 좀 먹고 수 많은 영화들을 보고 난 후에 봐서 천만다행,0
여러분 5월9일새벽2시인 지금 ocn에서 해줍니다. 이건 꼭 봐야합니다. 그냥 꼭 보세요,0
저렇게 멋질수가 있나...,0
박평식  대부도 깔줄 알았는데 ....,0
masterpiece,0
1편만한 2편이 없다는데 대부2는 그 속설을 파괴했다,0
대부Ⅰ에 이어 계속되는 불후의 명작,0
모든 상황이 정리되고 승리가 확정된 상황 하지만 자신이 만들어 놓은 룰과 가족을 지키기 위해 친형을 살해하는 하..,0
역대 최고의 영화 걸작중 걸작,0
영화사에 남을 장대한 비극.,0
속편같은거 아닙니다. 123 합하여 그냥 대부,0
비토의 젊은 시절과 마이클이 대부로 성장하는 과정. 두 영상이 서로를 관통할 때 그 느낌은..,0
아버지가  패밀리를 위해 가족을 잃진 않았나요?,0
톰 헤건 죽고 마지막에 ㅠㅠ 가족 다같이  1편에서 죽은 아찌랑 나올 때 죵니 너무 슬픔ㅠㅠ 그담에 알파치노 독샷 보고 엔딩크레딧 올라가는데 아 이게 여운이구나 싶더라... 크레딧보고 음악들으면서 울기는 처음임 진짜,0
인생영화에요ㅎㅎㅎ,0
원작을 능가하는 속편도 있구나... 라고 느끼게 해준 영화. 내가 제일 좋아하는 배우 알 파치노의 명연기는 말이 필요없다.,0
인생 최고의 영화. 별점을 주는 것이 미안해진다.,0
한 남자의 일생을 화려한 액션없이 신파없이 이렇게 멋지게 제대로 그려낸 영화는 아직 못본것 같다. 마지막 장면에 마이클의 표정은 정말로 진한 여운과 감동을 준다.,0
박평식이 9점을 준 영화임... 명작중의 명작!!! 꼭 보시길근데 1점 준 애들은 머지?,0
알파치노와 로버트 드니로는 꼴레오네 그자체다 이런영화 이런배우가 다시 또 나올수 있을까....,0
정말 역사에 남을 명작이다 이 영화를 안봤다면 불쌍한 인간이다!,0
박평식이 9점준영화 말다했지?,0
평가할만한 영화가 아니다.. 걍 봐라...;; 한국의 느와르 영화와는 차원이 다르네..,0
20년이 지나도 아버지를 이해하려면 난 아직 어리다.,0
영화 역사의 획을 그은 기념비적인 작품,0
그냥 점수 더 못주니 10점 줌,0
"젊은 나이에 처음으로 '몰입' 이라는 것을 경험하게 된 영화, 로버트 드니로와 알파치노의 연기는 단 1초도 딴 생각을 못 하게 만든다.",0
친구2가 대부2를 많이 따라한게 보임 아버지와 자식 교차 편집같은 장면  하지만 친구2같은 영화는 절대 따라오지 못함,0
"암턴, 영화사에 오랫동안 남을 명작임에는 이견이 없을 듯..",0
내인생에서최고의영화 대부1이더잼엇지만,0
개꿀잼 1보다 2가 낫다,0
다들 논하지마 다들 논하지마,0
전편의 명작을 뛰어넘는 걸작이 되었다.,0
보통 1편보다 나은 2편 없는데 그딴거 이 영화에선 없음 ㅋ1에서3편까지 쭉 이어서 봤는데 전혀 이질감이 없다 그냥 자연스럽게 하나의 커다란 이야기로 흘러감 ㄷㄷㄷ,0
대부1 과 2는 엄연히 다른 관점에서 봐야한다. 한편의 인생극장과 같은 2편은 아직 나에게 있어 미성숙함을 드러나게 한 영화이다,0
장엄하고 대단한 무결의 속편.,0
모든 영화들 중 가장 위대한 영화다.,0
알파치노와 로버트 드니로,0
아버지라는 세 글자가 무엇인지 생각하게 하는 영화,0
보통 전편이 후속작보다 좋은데 이건 이상하게 그렇지가 않네,0
"비토가 대부가 되어가는 과정, 마이클이 패밀리를 지켜내는 과정..마이클의 책임감과 외로움의 시작을 알린다. 가장으로써의 책임감.",0
전작과 마찬가지로 영화사에 기리 남을 작품이다. 더 이상의 설명이 필요없다. 남자의 인생이란 정말이지 형용모순이다. 마이클이 잘못된 건지 세상이 잘못된 건지  정말 모르겠다.,0
다시 봐도 재미있는 영화,0
"뭐 말이 필요하겠습니까? 전편을 뛰어넘는 속편, 알파치노와 로버트 드니로 이 둘을 한 스크린에서 볼 수 있다니ㅋㅋㅋ",0
"대부시리즈는 내가 본 어떤 영화보다 인상깊었다. 이와 비슷한 장르의 영화들을 보게된다면 ,나는 틀림없이 대부시리즈를 떠오르며 그 영화들을 폄하하게 될지도 모른다.",0
몇번을봐도 재밌음 세계의 명작,0
가족을 지키기 위해 괴물이 되어버린 마이클..,0
볼때마다 새롭게 다가온다.,0
역사적인 대 서사의 2번쨰,0
말이 필요없는 최고의 영화중 하나라고 생각한다. 닥치고 봐야될 영화,0
두 남자의 상반된 모습을 인상깊게 그려냈다.1편보다 개인적으로 2편이 더 좋았다.,0
대부시리즈 가운데 최고의 명작.,0
"대부2의 포커스는 비정하리만치 패밀리를 이끌어가는 마이클 콜레오네, 그의 아버지 돈 콜레오네의 파란만장했던 성장기와 어떻게 패밀리의 대부가 되어 가는지를 교차시키며 극명하게 대비시키고 있다.지루할 수 밖에 없는 내용을 전혀 지루하지 않게 만들어냈다..",0
단순한 범죄영화가 아니네요 ㅠㅠ정말 완벽한 영화인듯,0
알파치노의 고뇌하는 장면은 최고,0
알파치노의 차가운 카리스마는 잊혀지지가않는다,0
마이클 콜레오네의 본격적인 시대ㅎ,0
"재미로서도 완벽했고, 영화의 내용과 의미는 평생 기억할만 하다",0
대부 시리즈 중 최고라 생각되는 편. 특히나 알 파치노와 로버트 드니로를 한 영화에서 모두 볼 수 있다는 점.,0
"로버트,파치노 아저씨의 힘!!",0
평식이 형님이 9점 준 영화 처음본다; 근데 영화를 보면 왜 그런지 이해가 간다. 전설의 명작이란 것은 이런거지,0
추천영화 NO.3 IMDB 순위:3위 평점:9.0 /10,0
최고의 명작 이라고 하길래 봤는데 명작 맞다.,0
영화를 보는 내내 충격이였다. 원래도 아름다운건 알고있었지만 실제로 영화를 보니 오드리햅번이 얼마나 아름답고 재능있는 여잔지 온몸으로 느껴졌다. 길이길이 남을 명작 정말 추천하고싶다,0
로마의휴일과 쌍벽을 이룰만한 명작,0
댓글들 중에 요즘은 왜 이런영화가 안나올까...라는 글이 있다.문제는 이런영화가 안나오는게 아니라 이런배우가 안나오는것이다. 오~햅번~,0
61년 작이라는게 진짜 안믿긴다. 패션도 진짜 이쁨. 그리고 미국이 얼마나 선진국인지를 알 수있었다. 내용적으로는 진짜 좋았던게 우리 20대같은 7포세대가 보면 참 좋은 영화인거 같다.아무리 삶이 고달파도 사랑은 소중하고 위대하다는 것을 알려준다.,0
오드리 햅번.... 전무후무한 영원한 나의 이상형....,0
진짜 세기의 명작인듯 십계를 보고나서 그다음날 티파니에서 아침을 보고 딱 생각나는게 역시 사랑받는 영화는 그 주인공에 그 연기라는 생각이 문득든다 moon river도 참좋다,0
명작이죠 소장하고 싶은 영화,0
오드리햅번이 항상 사랑스러워보였고 마지막 극적은 최고였던것같아요ㅜㅜ,0
진정 명작이지 ..영화는 스토리에 혹은 기승전결에 의존해서 보는게 아니다. 영화 초반부에서 오드리햅번의 대사는 이미 나를 사로잡았다.  대사와 영화속 분위기 그리고 영상 ..  감정 .. 감성..  모두 나를 설레게 했다.  최고,0
오드리 햅번 영화중에 가장 좋아하는 영화!,0
오드리햅번 자체만으로도 빛나는 영화!!!,0
오드리룩이왜나온지알겠다스토리도짱,0
문~리버~ 노래가 감명적인 영화!,0
아름다운 오드리 헵번..,0
사랑스러운 오드리햅번의 명작이다,0
'남' 만을 보는 세상에서  '나'를 찾으라고 귀뜸한 영화.,0
혜인이 문수문수문수혜인,0
"오드리 헵번의 최고작.. 60년대 하류인생들이 진정한 사랑을 찾는 과정을 그린 로맨틱 코미디의 명작으로, 맨하탄의 풍경과 잘 어우러진 그들의 낭만적인 로맨스가 아름답게 그려진다. 라스트씬은 전설이 된 명장면..",0
진짜 하나도 안촌스럽다.보면서 울 할매가 불쌍해지더라.할머니 고생할때 저 나라 사람들은 저리 살았구나~ 싶어서.ㅋㅋ울 할매도 오드리햅번처럼 예쁜 옷 예쁜 머리하고 젊은 시절 보내셨으면 좋았을텐데.ㅜㅜ옛날 미국 영화보면 항상 이런 생각이 든다.ㅠ,0
오드리헵번이 가장 이뻐보이는 영화라고 개인적으로 생각합니다!@@,0
오드리햅번은 말그대로 개여신..말이필요없다....,0
아 정말 명작임에는 틀림없네요. 정말 빠져들어서 봤습니다.꼭 오드리 햅번때문만 아니라 영화자체가 오고가는 대화만으로도 이렇게 몰입감을 줄수 있다는게 신기할정도 입니다.,0
보는내내 스토리고뭐고  오드리햅번의 눈부신 미모에 아무것도안보였 ㅠㅠㅠ,0
이 작품은 1961년작이다!! 인류가 달에 간 1969년보다 무려 8년전 작품!! 근데도 이런 세련 된 영상미와 음악들..최신 로맨스 영화래도 믿겠다~오드리 헵번과 몽상가..Moon River..이런 분위기로 보는 감성작품에 스토리 운운하지 말것!,0
베스트임으로써오리헵번,0
Best of best,0
단순한 로맨스가 아닌 그 이상의 무언가,0
물질만등주의사람들이  봐야할 영화 의미가 크다,0
이게 1961년도 영화라니,0
"수십번은 본영화다...표현할수 없을정도로 너무좋아하는 배우 좋은 음악, 감동까지너무 좋은 영화입니다.",0
이렇게 이쁜 여자는  처음 본다,0
아름다운 성장담이다ㅠㅠ,0
"이 영화는 당연히 10점 만점, 명작이지..",0
"카메라 기술에 감사하게 되는 순간이 있다. 카메라가 없었다면 오드리 햅번을 볼 수 없었을 테니까. 오드리 햅번을 이 세상에 선물해주신 신께, 오드리 햅번을 세월의 장벽을 넘어 볼 수 있게 해주신 카메라 기술-과학자들께 감사한다.",0
자신의 현실을 잊은채 명품에 환장하는 사람들에게 보라고 권유하고 싶네요,0
명화라는 말이 절로 나온다.옛날에 만들어진 영화라는게 믿기지않을만큼 세련되고 재밌어서마지막 엔딩까지도 눈을 뗄 수가 없었다.오드리 햅번이 얼마나 매력적인 배우인지 잘 나타난 영화라고 생각한다.,0
무조건 보세요 진짜 추천 ㄱㄱㄱ,0
너무사랑스러운 그녀 명작임에 분명하다,0
최고에여 ㅠㅠ..명작이네여...,0
내 인생 최고의 영화,0
오드리헵번에 대해서 알고보면.. 정말 명작임을 알수 있다..,0
"다소 지루한 감이 있지만, 명작임은 분명하다.",0
진심 명작,0
♥♥,0
"불후의 명작, 오드리헵번의 매력을 마음껏 보여줬던 사랑스럽고 애틋한 이야기. 낮게 깔린 그녀의 음성으로 부르던 Moon River가 그리워지는 밤. 티파니앞에서 커피와 베이글을 물고 서 있고 싶다.",0
어제 여의도cgv에서 봤는데 너무 아름다웠다 다시 보러가고 싶다,0
문리버~ 음악과 영상이 조화로운 아름다운 영화,0
넘흐 좋아~~~ 닥치고 오드리^^,0
고전영화인데. 영화가 세련되었네요. 오드리헵번의 영화중 가장 예쁘게 나온거 같네요 ㅎㅎ,0
로마의 휴일땜에 오드리에 빠졌다가 오드리땜에 보게된 영화..,0
"패션의 역사, 영화 미술과 음악의 역사 그리고 오드리햅번이라는 최고의배우를 탄생시킨 세련미 넘치는 영화 !!!!",0
쨩,0
오드리햅번 진짜 최고:),0
정말 여운이남는영화네요 햅번씨도너무나아름다웠고 정말 감동적이에요!,0
명작인데.. 슬프고도 좋은 영환대 왜 별점을 낮추는건지..  좀 더 나이먹고 보세요 초중딩님들.,0
오드리는 정말 눈이 부시게 아름답다,0
"아름다운 뉴욕, 아름다운 사랑, 아름다운 오드리 헵번",0
재미있다 . 사랑의 본질을 알려준 작품이다.. 결국 사랑 이란 물질과 돈의 허영심으로 채울수없다는것을 이 영화는 보여주고있다.,0
한국된장녀들이 보고 각성해야 되는 영화다.. 계몽적인 의미가 담긴 부분에서 10점을 주도록하겠다...,0
그들의 이야기가 우리의 이야기가 된다.,0
말로 표현할 수 없는 감정들에 빠지게 만드는 영화,0
닮고싶고 존경하는 다큐,0
지난 상처가 따뜻한 창조물이 되어 빛난다,0
정말 근래 본 영화 중 촤고다!!,0
아 영화 너무너무 좋다...,0
잔잔하지만 매력잇는 영화,0
"현실에서는 무겁게 가라앉아 지긋지긋하게 괴롭힐 법한 이야기를 둘러싼 주변인들의 다양한 시선과 그들의 관점으로 해석된, 받아들인 진실들. 어찌됐건 사실은 있지만 진실 찾기는 허상이며, 삶에서 벌어진 많은 사건중의 하나. 현실을 이루는 요소. 대단하다",0
사람은 떠나지만 이야기는 남는다,0
최고 ! 사라폴리 사랑합니다..,0
다큐멘터리 영화에 대한 새로운 경험을 하게 해준 영화,0
"어릴적 흔히 듣곤 하던 ""다리 밑에서 줏어왔다""고 하는 얘기를 좇아가다가 드러나는 가족의 비밀. 숨겨진 이야기가 드러나도 동요하지 않고 위트있게 대응해 가는 성숙한 인간성이 돋보이는 영화입니다. 연출력도 뛰어나고 구성도 탄탄합니다. 좋은 영화입니다.",0
모든 순간이 좋은 영화였다.,0
어바웃 어 타임만큼 가족애가 넘치고 더 진실된 이야기. 오랜만에 정말 훌륭한 이야기를 보았네요.,0
"의도하지 않고 만들어진 이야기. 돌이켜보면, 우리의 이야기일 수도.",0
최근에 본 영화 중 최고의 평점을 주고싶은 영화. 사람을 사랑하는 것이 어떤 것인지 다시금 생각하게 하는 영화.,0
"마지막 제프 아저씨의 고백이 압권! 유머러스하고 진한 감동, 영감, 구조미까지 골고루 갖춘 완소영화!",0
"흥미로웠다. 모두의 인생은 한편의 영화라는 것. 우리의 엄마, 아빠의 인생도. 또한 나의 인생도. 나는 어떻게 기억될까..잠시 생각해보는 영화.",0
너무 재미있네요 사라폴리감독의 스토리텔링을 실감할 수 있었습니다.,0
내가 어릴적에 어니스트 시리즈랑 함께 즐겨봤던 폴리스 아카데미...비디오 빌릴 돈 없어서 친구랑 붐빠이해서 빌린다음 돌려서 봄,0
다시 태어난다면 천조국 경찰이되고싶다!,0
"어느새 20년은 되버린거 같은 영화, 떼로 등장하는 다수의 개성있는 생도들이 펼치는 슬랩스틱 코미디 퍼레이드로 쉴새없는 웃음을 전해주는 영화, 지금보니 헤어스타일이나 복장이 왜이리도 촌스러운지",0
지금 봐도 웃기다 ㅋㅋㅋㅋ,0
어린 시절을 떠올리게 하는 영화~ 부담없이 웃김,0
추억의영화,0
20년전 영화 지금보면 부실한 연기력이 보이지만 당시에는 잼있었던 영화지요,0
간만에 봐도 볼만하구나..,0
정말 최고의 웃기는 영화였다 얼마나 웃었던지 지금도 생각난다 단상 속 그녀,0
이제 추억이 되어버린 영화^^,0
완전웃김. 내용다 알고 보는데도 웃겨미침,0
코미디영화의 지존,0
최고의 추억의 코미디 영화,0
재밌는영화~,0
이거 지대로 웃긴 영화,0
옛날이나 지금이나 웃긴 영화 ㅋ,0
코메데의 절정판,0
돼게 재미있다,0
말 흉내내는 흑인 웃김..ㅋㅋ,0
영화 보고나서 네이버 평점보는데 깜짝 놀랐네요.인생 영화정도로 재미있었던건 아니지만 빵터졌던 부분도 많고 코미디 영화로써 볼땐 돈아깝지 않은 영화라고 생각했는데...저는 이 영화가 이렇게 심한 비판을 받을 정도로 재미없지는 않다고 생각해요.  평점조절,0
난 그냥쉬지않고웃었음 진짜유머코드가 내스타일ㅋㅋㅋ,0
내가 본 한국 최고의 코미디 영화다 정말 하정우 감독님 나중에 만나서 같이 작업하고 싶다. 감독님 나중에 뵙겠습니다. 꼭 감독으로 뵙고 싶어요.,0
이상하게웃김ㅋㅋㄱㄱ,0
아무 생각안하고 웃으면서 보기 좋은 영화!,0
코미디 영화.. 재미있다. 이정도면,0
재밌다 ㅋ재미있는것같아,0
완존 완존 잼는데 왜 ? 앤딩 크레딧 때 춤까지 춤 ㅎㅎ 좀 독특한 영화라 호불호가 갈리는 듯 나름 분석.. 아 더불어 앤딩 크레딧에 하정우 감독 일케 보고 깜놀 설마 했는데 배우 하정우씨가 맞네요 올 ~,0
"진짜 재밌다! 각각 등장인물 캐릭터가 살아있고, 연기하는거 같지않고, 실제 상황인거 같은 연기와 대사. 하하 이렇게 재밌고 여러번 보게되는 코믹영화 오랜만?",0
너무 웃겨요 ㅋㅋ빵빵터졌네ㅋ,0
나는 너무웃긴ㄴ뎈ㅋㅋ진짜 재밌어요지금 3번째 보고있음,0
저는 이런 병맛 B급 영화 정말 좋아해서 재미있게 봤어요 관심없던 하정우씨 팬도 됐습니다 또 이런 코드 이런 병맛 영화 제작해주세요,0
난 정말 웃기던데 코드가 맞나? 호불호가 갈린거 같습니다.,0
난 되게 재밌게 봤는데.. 센스있는 유머가 웃겼고 퀄리티도 떨어진다고 생각안한다. 그저 취향차이인듯.. 전개가 빠른것도 좋게 봤다.,0
말이필요없는 명작 ..,0
이렇게 재미있는 영화에 악평다는 쓰레기들은 뭔지..영화를 진짜로 보고 다는것인가??,0
진짜 재밋네요.정말 재밋어요 알바가 아니라 방금 ocn에서 보고 바로 남깁니다 ㅋ 정경호씌 욕 잘하네여 ㅇ,0
소소한 재미가 있는 영화.10점은 아닌데 평점이 너무 낮아서 10점 준다.2015년도에 나왔으면  좋았을 텐데.,0
이런병맛스러운게좋은데 나만좋은가 난되게 일부러이런 병맛스러운걸만들었다는게 좋은데 쓸데없이ㅇ진지한배우들ㅋㅋㅂ#재밋는데,0
재밌게 봤으요 ㅋㅋㅋㅋ,0
정경호 매력 쩐다...멋짐...,0
진짜 졷나웃기네ㅋㅋㅋ,0
난 아주  재미있게 봤음ㅋㅋㅋㅋ 내 스타일임,0
괜히 10점달면 알바인거같아 보이려나..특유의 시크한?듯한 컨셉도 마음에들었고배우들 연기도 좋았고 웃으며 재밌게봤는데 평점이 테러수준이네..정경호 연기좋았음,0
"진짜 완전 내 스타일 웃기고 재밌는 영화였는데, 정말 보고 오랜만에 맘편히 기분좋은 영화였는데 왜이렇게 평이 안좋지..",0
솔직히 1점짜리는 아니지,0
ㅋㅋ지금 롤러코스터보는데ㅋㅋ땅콩 나오고 욕설 나오고 뭔가 시기가 지금 나왔으면 재미있었을듯 ㅎㅎ,0
아 개짱ㅋㅋ 꿀잼ㅋㅋ 정우형 사랑해요ㅋㅋ 이건 남자영화임 ㅋㅋ,0
"왜케 평점이낮지? 각설하고, 극전개가 지루하지않고 각 상황의 요소요소들이 재치있는 대사와 승무원이라는 감정노동자들과 육두문자의 조화ㅋㅋㅋ 제법 괜찮게봤음, 승객들 한명한명 개성이 강해서 보는재미 쏠쏠했네요 주관적인 평점은 8점정돈데 걍10점!",0
나만재밌나방 재밌쩡 많이 재밌쪙,0
소소한재미 ㅋㅋㅋ 대사 하나하나가 넘웃겨,0
"Good,,....",0
제가 영화에 대해서 잘 모르지만제목 그대로 내용또한 전개가 롤러코스터같았어요재밌게 잘 봤습니다^^,0
"내 코드임. 연출, 각색 등 많은 요소 진심 헐리웃 진출해도 어느 정도는 할 수 있을 듯",0
개그코드가 저랑 넘맞아서...,0
하정우 이 양반 정말 재밋는 사람이야. ㅎㅎㅎ 허삼관 보고 이거 봤는데... 각 사람마다 캐릭터를 너무 잘 살렸는데.  생각의 차원이 너무 다른것 같음 형이하학적으로 보이나 그 내면에 있는 모습을 너무 잘 표현 했는것 같음... 아무튼 너무 재밋게 봤,0
영화에 표면적 의미부여가 필요한가? 우습다,0
왜 나는재밌었는데ㅋㅋ그냥 평점조절용이로 10점줌,0
생각보다 잼난ㅡㅡ기대안해섭,0
극장에서 놓친게 아까운 영화. 최근 우리나라 세태를 유쾌하고 재미있게 보여주네요. 특히 사무장이 회장과 회장비서 앞에서 무릎꿇고 계속 죄송하다 할 때는 땅콩회항과 오버랩 되내요. 다만 대사가 너무 빨라 두 번째 봐도 못들은 대사가 아깝네요^^,0
나는 하정우랑 개그코드가 맞나보다 엄청 재밌게봤네요 특히 단발의사샘 장면에서 계속 빵터짐 ㅋㅋ,0
이제서야봤네요 하정우씨 개그코드가 맞나봐요 전 너무재미있게봤어 ㅎㅎ 캐릭터들마다 연기다잘하신듯요,0
