슬혜씨.. 벗으려면 제대로..,1
원작이 후졌다고 영화도 나쁘리란 보장은 없지만 이건 점입가경이다,1
아니 두치한테 몇대 맞았다고 거의 다 죽은 사람이 됬냐ㅋㅋ,1
영화감독이 꿈인 분들이 있다면 패션왕을 보시면 될 것 같아요. 이렇게만 안만들면 된다고 생각하고 보시면 됩니다....,1
"0,5점은없음?개10노잼 기안한테 미안하지도않냐",1
"뻔한 컨벤션, 맛없는 대사, 최악의 연출, 원작과의 연관관계 없음! 감동과 병맛 그 어느것도 충족 시키지 못했다 한마디로 역겨운영화",1
왜 만듬 진심 샘각하네????,1
"일개 바람막이로 하늘을 날다니...감독 진짜 무슨 생각하고 연출한건지,진심 뇌를 한번 열어보고 싶다...(웃음)",1
야구에 관한 내용보다는 문란한 두 여성 애니와 밀리의 진정한 사랑 찾기가 주된 내용이지 싶음. 개인적으로는 재미도 감동도 못느꼈는데 다른 분들 평가를 보니 다들 수작이라고 해서 당황스럽네요. 그나마 짧은 플레잉 타임이 장점이라면 장점.,1
뭔 야구영화가 이따위야,1
별 재미는 없구나...,1
영화내내 되도않는 만담을 듣고 있자니 머리가 어떻게 될거 같았음. 분명 웃기려고 하는 걸텐데 진지한 부분도 개그같고 개그는 안웃기고 어쩌자는건지;; 우리랑 일본은 개그포인트가 정말 다른거 같다. 예전에 와라이메시가 한 토리진은 진짜 빵터졌었는데....,1
이딴 걸 영화라고 만들거면 차라리 이말년 시리즈를 20부작 영화로 만들어라. 무슨 개콘수준 꽁트를 짜깁기 해논거같다,1
짜고치는 고스톱에 마지막 장면 진짜 허무함.ㅡㅡ,1
제목에 낚였다. 사랑에 관한 모든 것이라더니 스토리는 산으로 간다. 등산에 대한 모든 것이라고 하던가 아니면 그냥 번역 없이 the theory of everything이라고 하던가 으이구,1
"원제도 한국어제목도 다 안 어울리는 억지 신파 영화,불륜 미화물.",1
제목과는 전혀 다른 내용,1
별 그지같은 영화ㅋㅋ 무슨 법정에서 말로 사람 약오르게 해서 말실수로 자백을 받아내냐 ㅋㅋ,1
"반전의 반전...,,",1
이야기의 개연성이 부족하고 이해가 안되는 대목이 많다. 오직 감정에 의한 호소만으로 영화를 이끌어가니 지루할수밖에 없다. 한국에서 리메이크한다고 하던데 똑같은 스토리라면 한국에서는 절대 먹히지 않을 이야기,1
반전이 있는 법정영화는 상당히 매력이 있다. 그러나 현실성 없는 스토리는 명탐정 코난과 용호상박.,1
그저 그래여ㅋ 근데 평점이 너무 높아서ㅠ,1
10101010101010,1
반전이 뜨뜨미지근하네요...  역시 기대하고 보면 안됨!,1
"대중의 취향이, 적어도 우리나라 영화관람객의 취향은 촌스럽다는 걸 이 영화 평접으로 다시금 느낀다ㅋ",1
평점에 속았음..그냥 7점 정도의 애니...,1
졸림 7세여아는 나름잘보고 잼잇엇다네요,1
그냥  재미없다.ㄹ화ㅡㄹ헤ㅗㅡㅔㅐ그,1
30년전에 봤으면 재밌었을지도...,1
20년전 영화라는 변명은 좀 궁색하다. 세월이 무색하게 좋은 영화도 많으니까,1
스토리가약하다 20년전많이기대하고본영화지만 사실좀 실망..7점정도가적당,1
이제 그만해라 지겨워 죽는 줄 알았다,1
테이큰은 다 똑같지 뭐...,1
흰빤스 입고 싸우는 보스.,1
부인까지 희생시켜 가면서 3편을 찍었어야 했나. 설마 4편엔 딸이나 손주를 살리기 위해 또 아버지가 나서는 건 아니겠지...신선했던 노익장의 액션은 3편에 와서 모두를 지치게 만든다.,1
미국까지 가서 이런 영화  왜  만든거야~~ 참  한심스럽다.,1
별한개도 아까움  정말 최악중에 최악인영화살다살다 이딴영화가 극장에 개봉을 하다니..너무하네정말!!!,1
일단 강지환 팬이라 봤어요. 열심히 제작하신 감독님 배우들께는 죄송하지만 이 영화는 대체 뭘 말하는건지도 모르겠고 보다가 끌뻔했지만 꾹 참고 봤어요. 영화가 보고 감동이라도 있던가.기분이 썩 좋지도 않고 제 평생 다른의미로 가장 기억에 남을만한영화예요,1
진짜 개 망작이다ㅋ 감독이나 배우나 스토리나 헛웃음만 나온다ㅋ,1
일단 강지환이 나오는 영화는 다 비추합니다.,1
초대박 강추 영화입니다^^,1
비번까먹어서 간신히 찾아서 별점남기는데... 감독 배우 진짜 총으로 쏴버리고 싶다.,1
볶음용 멸치와 조림용 멸치가 미국에서 주먹자랑하는 내용.,1
배우들의 연기력 여부를 차치하고라도.. 이 정도 개런티 받는 배우들로 해외촬영해서 이 정도 퀄리티 뽑아낸 것도 능력이라면 능력이다.. 그 능력에 감탄해서 별 1개 더준다...,1
청소년 관람불가 뿐만 아니라 성인도 관람불가입니다.,1
영화를 보다가 잠깐 화장실에 갔는데 거기에 써있던 윤동주 시가 더 재밌었다,1
나의 절친 악당들의 뒤를 이을 또 하나의 똥떵어리를 낳다.,1
앞으로 강지환 영화는 다신 안보기로...,1
"시작 후 30분까진 뭔가 뻔하면서도 재미 있었다..30 분 후,주인공이 출소 후 5년만에 그 여자 다시 만나면서돈뿌리는 장면... 거기서 그냥 나왔다..뻔하지만 가끔 감동을 주는 영화도 있기에,30분을 투자했건만..후회한다..",1
어휴... 관두자.. 뭐라 쓸 말도 없다...,1
이런 3류 영화를 요즘도 만드는구나...,1
실패한 한국형 느와르..,1
시대에 뒤떨어지는..이것도 영화라고!!배우들과 미국촬영이 아깝다..외화낭비..누가 배급해준건지;;,1
"돈을 써서 혜외로 나가긴 했지만, 단지 영하속에서만아다.. 이것도 저것도 아닌 그냥 하던가 찍어야지 뭐...",1
그렇게재미없었나요? 오늘의연애보다 재미없나요?,1
별 0개를 줄 수 없다는게 너무 아쉬운 영화,1
"감독님, 똥이나 싸세요.",1
혼난다 진짜 콱~ 진서야  니가 무슨 A급도 아니고 화끈하게 벗어라 콱~,1
별 반개도 아까움 .. 아나 진짜 이런영화 왜만드는거야??,1
강지환 윤진서 요새 캐스팅이 잘안들어오나? ㅋㅋㅋ 제목하며 영화만들어논 꼬라지하며 ㅋㅋㅋ,1
무엇을 상상하던 그이상입니다! 진짜..ㅋㅋㅋ 할말없게 만드는 영화..욕도 안나옴ㅋㅋㅋ,1
"내 살다살다ㅋㅋ이딴영화가 다있노ㅋㅋ중간에 끄려는거 마지막에 반전이라도 있겠지 싶어서, 멜로영화인지 르와느 영화인지도 모르는 영화를 헛웃음 내밷으며 봤소ㅋㅋ이 감정을 느끼고 싶음 보시오ㅋㅋ진심 시간 아깝소. 10점 준 님들 대단하시네ㅋ같이 죽자는거지ㅋ",1
이거보면 암걸림 삼류영화중에 탑인듯 진짜 무엇을보여주는지 아무것도 알수없는 영화 입니다,1
비싼 돈들여 미국에서 촬영한것은 좋은데 내용이 없음. 지루하게 전개되다 주인공사망 끝. 이게 뭐야~~~~,1
투자자들 돈 날리셨네요. 러시아 포르노 배우 섭외 비용이 많이 들지 않았을까 생각이 드네요.,1
ㅋㅋㅋㅋ1점도주기싫다ㅠㅠ,1
너무한 영화다....,1
"강지환, 윤진서의 안목이 이정도일리가 없는데.. 뭔가 이상하다. 이 영화의 탄생 배경이 의심스럽다",1
??윤진서 나오면 왠만한 남자주인공 아니....진심 미.친. 연기력 주인공에 확실한 존재감 조연 다 배치 되지않는이상 보지 말것...진심 낭비다.이 영화는 빵점이 정답.스토리 없구 주연배우 강지환 그저 그럼...여주인공 꽝..조연이 그나마 낫다,1
영화 속 배경은 정말 예술이던데...살짝 촌스러운 느낌의 연출(?)...연기도 내용도 매력도 도무지 모르겠던...알 수 없는 어정쩡한 막무가내 느와르...?점점 초라하고 측은해지던 보스의 모습 ㅋㅋㅋ,1
내가본 한국영화중 역대급 쓰레기영화다. 진심 돈아깝다.,1
17422명 봤는데 벌써 iptv로 풀었나보네 ㅋㅋㅋㅋ진짜 오지게 재미없나보다,1
글자가 아깝다 가나다라마바사아자차카타파하,1
맨눈으로 태양을 보는게 더 재밌겠다,1
알바쓰지마~~ 더럽게 돈아깝네,1
엔딩도 구리고 이딴게 느와르랍시고 설치네. 윤진서 노출도 볼거 없고 웬 가슴 큰 양키아줌마노출 따위 누가 보고 싶냐 감독세키야 해외 나가서 촬영하느라 고생한거 같아 1점 더 줄려고 했는데 생각해보니 이것들 외화낭비만 하다 왔네ㅡㅡ,1
ㅋㅋ라디오스타에나와서 썰이나풀자,1
감독 면상에 쏘고 싶다..,1
도대체가 무슨 영화인지 알 수가 없다. 태어나 처음으로 중간에 뛰쳐나간듯,1
윤진서는 대체 왜 영화 베드신마다 화끈하게 벗어줄거같다가 꼭 벗다 마냐?? 이번에도 김새네 액기스도 없다 이건,1
이 80년대 스타일의 허세 가득한 영화를 도대체 왜 만들었을까?,1
차라리 이거 볼 돈을 기부하던가 다른 영화를 보자!,1
강지환은 쾌도홍길동이 유작이지,1
"돈주고 다운받아서 받는데 ....왠만해선 내가 이해하면서 봤는데..정말 내생에 최악,,,",1
잊지 않으마  김태식....,1
다른 영화들이랑 똑같은 요금 받는거 안미안해?? 진심??,1
이 영화를 만든 의도가 뭐냐?,1
감독을 쏴라 (10자),1
윤진서는 역시 홀복이 잘어울려,1
"암걸리겠네요 젠장, 열자",1
ㅋㅋㅋㅋ아웃겨죽겟네 ㅋㅋ,1
평점 알바생들 보이네 ㅋㅋㅋㅋ 비디오로도 아니 토렌트로도 다운받아 보지마삼,1
거지 같은 영화  보지마셈,1
멜로 로맨스 느와르를 사창한 삼류,1
절대 보지마세요 욕나오다못해 최악최악최악인영화,1
너무 어이가 없네요. 개봉한 지 얼마 안 된 영화의 평점은 믿을 게 못 된다는 걸 다시 한 번 느낍니다.,1
진짜23년인생중 최악의영화 올레무료영화는 명작인듯느껴짐 그냥 밑도끝도없는영화10점짜리 다알바예요 1970년대영화인줄,1
"30년 전인 1985년 개봉한 안성기, 장미희 주연의 미국 올로케 영화 '깊고 푸른밤' 과 비교된다. 2015년에 개봉한 영화 수준이 이 정도 밖에 안될 줄은 상상도 못 했다. 작위적인 스토리 전개와 연출력에 출연한 배우들이 안됐다는 생각이 든다.",1
진짜 시간많고 돈많은사람 한번만 보세요 열받는다. 아,1
"김민종의 어색하지만 풋풋한 반항아 모습을 볼 수 있는 영화. 이미연, 김보성보다는 김민종 때문에 본 영화. 제목이 더 유명한 영화",1
행복은 성적순이 맞다는거!!!,1
"행복은 성적순이잖아요...설마 포크레인옆에서,삽질하면서,잔잔한일상의 행복을 느껴?",1
당시에는 트랜드였던 작품. 이미연이 엄청 이뻤던 기억이 남,1
영화 역사상 마지막 장면은 최고의 반전!,1
지금보면 뭔 내용인지 이해도안감 아무리 평점 높게주고싶어도 이건 해도해도 너무함,1
옛날 영화라고 생각 안해보면 기술이 떨어지고 지금의 혹성탈출과 비교될수있는 촌스러운 영화,1
이제는 촌스러움이 되어버린 스타일.,1
한마디로 재미없다...,1
최악의 여성학대영화 여주인공 트럭위에 올리고 달릴때 경악 요즘엔 개도 차에 저렇게 태우면 잡혀감,1
여기서 1점을 주면 평균10점에서 5.5가되겠지,1
타르코프스키 급 졸음 유발자,1
그냥 심심해서 헤헤헤 ㅎㅎㅎㅎ,1
이거 영화 업사이드다운 소재가 너무 똑같은데... 역시 일본이다... 있는 소재 지들꺼로 바꾸는 수법,1
와 높은 평점을 보고 봐서 그런지 기대를 많이 했는데 너무 재미없었네요...소재만 신선하고 나머지는 너무 뻔한 전개들... 영화가 아닌 일본애니만화를 본 느낌이었어요 이 소재를 다른 감독이 다르게 풀어나갔다면 훨씬 잘 풀어나갔을 것이라고 생각합니다.,1
하늘 위에서 판타지를 꿈꾸다가 이야기는 그대로 공준분해. 이것저것 건드리다가 다 하늘로 간 영화.,1
소재만 좋고 나머지는 다 허술하기 짝이없음,1
미안.. 재미없어..,1
정말 재미없다ㅏㅓㅓㅓ,1
겨울왕국인줄;;ㅋㅋㅋㅋ,1
화질도 별로이구요아기들이 보기에 조금 무서운 내용이었어요,1
애니다운 맛이 없는 조악한 이야기,1
레고인간님아 낳다가 아니라 낫다 인데요 맞춤법 모르시나 그리고 영화는 노잼이랄까,1
그래픽 수준 봐라ㅋ.ㅋ.ㅋ.ㅋ.ㅋ.ㅋ.ㅋ.ㅋ.ㅋ.ㅋ.ㅋ.ㅋ.ㅋ.ㅋ.ㅋ,1
겨울왕국짝퉁100%망함,1
스토리전개가 너무 느리고  딱히 하이라이트장면도 없음캐릭터도 별로이고 캐릭터의 개성도 안살고 돈주고 본게 넘 아까움.,1
"진짜 보지마삼,집에서 가까운데 상영을안해 건대까지 가서 봤는데 차비에 정성에 이렇게 돈 아깝긴 영화관 찾은이래 첨,,심하게 성의없는 내용!!!",1
6살 딸래미와 우리별1호와 하고 이디야 하고 봤는데 우리별은 스피커소리가 커서 좀 놀라기는 했지만 재밌게 봄 이디야는 뭔가 잘못만든거같음 그흔한 노래도 거의없고 자다옮,1
제목보니 겨울왕국 인기에 편승하려는 수작이 보이는구나. 원제는 전혀 다르구만 ㅉㅉ,1
제일재미없는영화이다,1
뭔가 보여주려다가 못보여준 느낌~~  조금은 아쉽네요,1
봤는데 재미없다겨울왕국이 낳다는생각이든다,1
성우빠들이 작품에 상관없이  성우  썼냐 안썼냐로 평점 메기는  어이없는  애니메이션계,1
진짜 성룡형팬이었는데 스티븐유 하도 감싸고돌아서 용이형도 이젠 비호감스럽다.,1
솔직히 성룡 영화중 굉장히 지루한 영화....,1
액션은 거의 없고 성룡영화중에서 최악... ㅡ ㅡ;,1
good,1
예쁜 여배우 덕분에 성공한 영화,1
too slow ...,1
제니퍼 코넬리 외엔 봐줄게 없었던...,1
이 영화나 영구씨리즈나.. 제니퍼 코넬리가 예뻐서 점수 많이 준다.,1
배우들 연기를 왜 이렇게 못하냐.... 내가 해도 그거보다는 잘하겠다.,1
평점에속다..아..패킷아까워..벌거벗고다니는OOO 궁디빼곤볼게엄네요..버렸어영..,1
같은시기에 만들어진 데드얼라이브와 비교하면 별로 .. -_- 웃기긴함 ㅋㅋ,1
옛날에 안봐서 모르지만 지금보면 최악이다 완전 우뢰메 수준,1
1편 어설프게 흉내내다 결국 난장판 만들기,1
에휴.....,1
많이 부족한 속편. 등장인물도 부족하고 상황도 별로 와닿지 않음. 대실망.,1
좀비가 차끌고 얘기하고 달린다 ㅋㅋㅋㅋㅋ 고어장면도별로없고 별로임 ㅋㅋㅋ,1
전편보다 못했다 확실히,1
재미? 없다 여운? 조금있다,1
전설따라 삼천리(삼만리인가?)에 의하면 이 영화가 꽤  괜찮다고 할뿐 아니라 내가 좋아하는 장학우에 장만옥까지~....하긴 전설의 고향이라고 다 재밌진 않았다.  엉망진창 스토리는 왕가위도 배우들도 손놓은듯..담배회사가 만든영화임에 틀림없다!!,1
.,1
??참나.. ㅠㅠ 너무 기대했음..,1
이거 왕가위 작품 맞나요 찌질한 스토리에 걍 평범한 화면 볼건 장만옥밖에 없네;;,1
"왕가위감독의 스타일이 거의안보이는,짜증나는 영화다..하류인생영화 못봐주겠네..",1
장만옥 본다는 기쁨 하나.. 스토리가 넘 빈약하다 ㅠ.ㅠ,1
"왕가위의 작품이라 믿어지는 것은 몇 독특대사와 카메라앵글, 색감 뿐. 스토리 최악",1
아 진짜 이건 뭐 내용도 별 없고 남는 것도 없고 그냥 어설플 뿐.,1
"단순하네요,영상은 그래픽이고  그먕그렇네요..",1
운석 다큐맨터리 인줄...,1
그나마 베수비오 화산의 폭발 장면이 있어서...,1
여주 이상하게 생겼고 흑형이 10캐리함,1
핵노잼슈퍼노잼개노잼,1
왕좌의게임 팬인데 존스노우 나온다해서 한번봤는데 왕좌의 게임에 눈 높아진건지 이건 뭐 갑자기 같지도않게 말 진정시키다 여주보고 같이 타라고 하더니 도망(?)아닌 이상한짓 하고 잡히고 난 뒤부터 흥미 잃음,1
스파르타쿠스나 글래디에이터 생각하고보면 실망할겁니다. 재난영화입니다..,1
서사의  수준을 따지기가 미안할 정도로 아무런 내용이 없읍니다.  인물은 빤하고 전개나 장면 잡는 방식은 더욱 빤합니다.,1
주인공 일행은 자기들이 선이라고 떼를 쓰는 어리광쟁이들에 불과하다. 그들이 하는 행동들이 결코 코르부스만을 악이라고 단정지을 수 없어서 코르부스를 응원하게 만들어버린다. 무너지는 저택에 연금된 '연약한' 카시아가 살아남는 장면도 너무 작위적이다.,1
여주인공이 더럽게 못생겨서 영화에 집중이 안되고 남주인공한테 감정이입이 전혀 안됨. 하녀로 나온 제시카 루카스가 훨씬 이쁨. 제시카때문에 빵점 줄거 1점 드림,1
여주 얼굴 사각형잼ㅋㅋ,1
못생겼다하는것들 자기얼굴을 보고말하는건가?,1
이쁜하녀와 핵존심 츤데레 흑형때매 그나마 2점 줌 ..내용이 너무 일차원적임 .. 초반에 브리타니아 나오고 실존인물처럼 페이크치고.. 뭔 의원이 여자하나에 환장해난리고 아가씨와 노예의 억지로맨스;; 주인공에게 무한 츤데레 흑형과 우정도 사실 억지스러움,1
스토리 0점 영상 8점여주가 못생긴걸 배제한다고 해도 실체없는 스토리때문에 스케일 뽑아내는 데 쓴 돈이 무의미해질 정도똑같이 검투사 다루는 영화인 글래디에이터와 나란히 놓고 봐도 이건 아니다 싶을 정도로 비교 자체가 무의미함. 인심 써도 3점.,1
남주는 존잘인데 여주는 진짜... 몰입도 겁나 떨어짐 ㅠ,1
진부하고 오들거림..감정이입 안됨.,1
살려고 아둥바둥거려봤자 화산 폭발하면 모두 사망하니깐 디게 찝찝하네,1
sf 영화 입니다 여주인공 얼굴이 ... 내용은  잼있습니다,1
아놔 시댕....내돈....ㅠㅠ,1
완전 암유발영화 속답답해 죽는다...결론도 없고..관객에게 생각을 맡긴다? 정도도 아님...속터져,1
별로였어요 씨쥐도 허졉했고,1
평점10 준놈들 날짜보면 전부 2월20일~21일 이틀간 몰려있음. 평점알바들 알바비 얼마씩 받냐?? ㅉㅉㅉ,1
내 인생 최악의 영화를 꼽으라면 바로 떠오르는 영화,1
시간아까우니 보지마셈 유치뽕짝뽕뽕짝짝영화ㅡㅡ 뷁,1
남는것도 없고 주는것도없고 별거없는데 그냥 보면 볼만하다. 흑형이 멋있다.,1
그나마 CG떄매 별 하나 ㅡㅡ여주인공 못생김스토리 진부하고 지루함화산터진 장면 하나 빼고는 다 별로이걸 돈주고 보다니ㅠㅠ ㅠㅠ,1
평점 왜케 높냐. 명작 글레디에이터 내용에 + 자연재해 + 오글거리는 로맨스 3짝꿍 짝짜라꿍짝된 영화. 아 오글거려.,1
이건뭐지 스파르타스 드라마에 재난영화를 짬뽕해는데 재미는 없음 ㅡㅡ,1
티비에서하길래 우연히봣는데 갑툭튀개쩌네요...ㄷㄷ 근데 별로 재밌진않엇고 뭔가 답답하다고해야하나,1
한시간이 넘도록 지루하게 전개되는군,1
누구나 영화감독 할 수 있다는 꿈을 주는 영화..근데 돈내고 봤다니....,1
좀 멍청한 영화.. 그래도 피비 케이츠는..,1
정말 무지하게 재미없다.,1
피비덕분에 3점이라는 높은 점수를 준다,1
피비빼고 다 최악,1
최고의 틴에이져 톱스타들이 총출동하는 싸이코 액션 스릴러,1
존나재미없네,1
그냥 아무생각없이 보면되요~~눈요기감이징~~,1
친구의 추천으로 봤지만 나와는 맞지 않는 듯. 소림축구와 쿵푸허슬은 진짜 재미있게 봤는데 이건 좀 아닌 듯,1
"졸립고, 졸립고, 졸립다",1
웃기지도 로맨틱하지도 않다,1
평점이 이렇게까지 높을만한 영화는아닌데,1
...별로,1
너무쉽다...최악이다,1
지금에 와서 보니 상당히 지루함. 기억에 남는 건 엄진동과 황비홍의 사다리 액션신 정도. 그리고 아름다운 관지림 정도. 후에 나온 철마류나 의천도룡기가 훨씬 더 스토리도 재미있고 액션도 화려함,1
언제적 영화여?,1
소소...,1
good,1
평이. 1편이 낫다,1
굿,1
뒷 끝이 찝찝한 영화였다.,1
"대체왜 이영화가 9점대일까, 좀 떨어뜨리자,",1
"무서운 영화였던 1편의 빈틈을 메우는데, 처음부터 끝까지 정말 쓸데없는 짓거리다. 특히 공포 요소는 눈곱만큼도 없고, 오히려 웃기는 장면들로 가득하다. 1편의 명성에 먹칠하는 쓰레기 같은 속편.",1
역대급 쓰레기...와...돌겠네;;,1
윌리엄 프리드킨 스타일이 더 좋았다.1편이 최고다.,1
린다블레어 출연의 엑소시프트의 정통 후속작을 존 부어만 감독이 부어잡고 만들었는데도 이런 퀄리티라니.. 왠 미친 메뚜기 떼들만 마구 달려든다 아 웃겨..,1
파주주의 기묘한 모험이다.,1
할말 잃음,1
명성대비 쓰레기 영화,1
영화는 지루하고 설득력은 제로,1
카톨릭으로 시작되어 미신으로 변색되버린 엑소시스트.,1
진짜 잼없다...이거....,1
메뚜기 박멸시키는 세스코가 상대할수준,1
미안하다. 보다 잤다.,1
다세포 소녀다음으로는 마스크2그다음은 이 영화,1
괴롭다 쓰레기,1
죽을래?,1
전편의 후광을 등에업고 성공하려면 잘 만들던가,1
공포영화 아님. 무서운 거 원하면 절대 보지 말것. 재미도 없음,1
이건 공포영화가 아니다.,1
.,1
이건좀아니다,1
반전이라도 있겠지 - 하면서 봤던 나는 실망실망실망.,1
인디아나 존스를 더욱 돋보이게 해주는 쿼터메인 시리즈,1
인디아나존스 베낀거다!!!! 안봐도 비디오~,1
인디아나 배꼇다고 밖애 할말이..,1
내 메모리 리스트에서조차 지워버리고 싶다,1
이야기의 초점은 없고 쌈박질하며 노는 애들이 지나치게 진지하다,1
평점6정도가적당한영화,1
어색한 어린배우들의 연기..진부한 조폭씩 패싸움,1
이런 재미도 없는 걸 두번이나 봤다니,1
재미없다. 흔한소재.,1
전혀 무섭지도 놀래키지도 슬프지도 짜릿하지도 않다,1
평점이 왜 이렇게 높죠? 진짜 알바가 있는건가? 내 인생을 영화로 만들어도 이보다는 무섭겠다,1
"공포영화 정말 좋아하는 편인데, 이건 좀 아님 !!  흉내내다 만 영화임",1
이렇게 안 무서울수도 있다를 보여준 공포영화,1
"공포영화 보면서 잠자보긴 첨이네.. 내용이 그렇듯,, 공포의 현장에서 일어나는 사건들이 지지부지하고 시간이나 때우려는 듯한 느낌였음~ 결국 아무 느낌도 없이 뭥미만 찾다가 퇴실..",1
어거지 사운드 귀 아프다,1
아 보다잤다....뭐 놀래는장면도없고,1
졸다가 놀래서 깨고 ~다시 자다가 깨고~  에이C,1
핵노잼  호러물 매니아들은 절대 보지 마시길... 시간낭비;;;,1
이거 장르 공포 맞죠...? 저 무서운 거 하나도 못 보는 사람인데..호기심으로 봤거든요? 완전 두 눈 다 뜨고 멀쩡히 봤네요..재미도 없고 스토리 진행도 구리고..,1
소리만 질러댄다...,1
"베댓진짜 노답  스토리빈약,사랑은 왜 껴넣은거임? 댓글들보고 기가찬다 기가차.. 노답",1
사운드로  놀래키는 영화 ... 재미없어요,1
머니볼 정도를 기대했건만..   밋밋한 스토리에 다 보이는 내용,1
"머니볼 이상의 재미라길래 봤지만, 너무 실망스러웠다.. 이깟 영화가?",1
윽... 그다지 감동적이지도 않고 재미도 없고.,1
여주 개암걸림 후반부터 개짜증,1
장르가 로맨스냐?  연애질만하고#또 주인공버프가 심하네 막장도아니ㄴ고;;,1
음...추천 보고 돈 주고 받았는데 왜 ..안보는지 알겠음.,1
말도 안되는 영화. 과학기술이 사람의 정신을 지배해 군대로 만들어 체제를 확보하려는 수준인데 사랑한다는 말에 제정신을 차리는 쌍팔년도 신파극을 헐리웃 영화에서 볼 줄이야...영화에서 다이버전트는 인간다운 인간 아냐? 사이보그가 되다니...,1
ㄱㅐ재미없네 평점너무.높은듯 그래서 1점,1
정신머리없는 10.20 여자샣@끼들아 남녀별 평점봐라이거... 개시@발 존@나게 재미없는 영화를 평점을 이리주냐? 발로만들어도 이거보단 잘만들겟다,1
미국말고 중국이 이렇게 되라,1
뭐 원작을 보라는데.. 원작 안본사람 입장에선 그냥 여주 쓰래기처럼 나오던데 ㅋ 자기 분파 버리고 남자랑 노는 영화임,1
이 개 쓰레기 영화를 돈주고 봤다는게 너무 아깝다. 현재 사회 분파 얼어죽을 제작비 아낄려도 푸닥거리짓 하는거랑 중점 내용도 없이 지들 쥐좆대로 진행 되는거랑 스토리? 니미 중학교 2학년이 써도 저거보단 개연성있겠다,1
도저히 몰입할 수없는 캐릭터 설득력없는 스토리 쓸데없는 복선과 배경설정 지나치게 가벼운 총알의 무게감 90분대 런닝타임도 질리게만드는 식상한 구성. 김이 빠질대로 빠진 맥주를 마시는것같았다,1
뻔한미국식 서부극 이제그만나올떄도돼지않았냐?,1
